Name,PlaceID,Address,Rating,Author,Review
Pearl Tea Airport West,ChIJ1zOX4Cpb1moR486JZuOieoA,"35 Louis St, Airport West",4.3,Sarath Vegasana,Had the grape green tea! Was yum! My partner had a soda. Was super refreshing. They have mega size which is really good huge bubble tea drinkers!
Pearl Tea Airport West,ChIJ1zOX4Cpb1moR486JZuOieoA,"35 Louis St, Airport West",4.3,Isuru Weeraratna,"Best bubble tea I had in Airport west and you should have Thai green bubble tea and always requests for the bubble seeds, affordable price."
Tea Room at National Gallery of Victoria,ChIJi3CHtLFC1moRqA2FGIKKHXo,"180 St Kilda Rd, Southbank",4.5,Brooklyn B,"Simply incredible! We enjoyed the high tea with champagne. Everything was incredible. All the food was beyond amazing. We were treated with care and respect. The customer service was next level! I hope the waiters and chefs are paid very well, they all deserve it. Thank you so so much."
Tea Room at National Gallery of Victoria,ChIJi3CHtLFC1moRqA2FGIKKHXo,"180 St Kilda Rd, Southbank",4.5,Lucien Lim,"A great place to sit and chat with friends and loved ones after visiting the NGV. While the food and tea weren’t anything special, the service was so good that it made the food and drinks taste better. In particular, our main server was extremely courteous and friendly, really brightening up our day.

A lovely experience overall, highly recommended!"
Tea Room at National Gallery of Victoria,ChIJi3CHtLFC1moRqA2FGIKKHXo,"180 St Kilda Rd, Southbank",4.5,Gina,"Yum yum, 🥂 club sandwiches, savory pastries, the most delicious little sweet treats topped off with Tea, scones, Jam & cream. With a nice walk around NGV. Who would have thought this little place existed 😍"
Tea Room at National Gallery of Victoria,ChIJi3CHtLFC1moRqA2FGIKKHXo,"180 St Kilda Rd, Southbank",4.5,Bronwyn Dajczer,"Fabulous experience of High Tea @NGV. It was busy as it's the Christmas/New Year break but we were warmly greeted, served with grace and the food was delicious.
The Champagne was creamy and refreshing, the only fault was the thick glassed flute. The food was amazing and just enough without being too much to enjoy.
Definitely recommend this treat 💕"
Tea Room at National Gallery of Victoria,ChIJi3CHtLFC1moRqA2FGIKKHXo,"180 St Kilda Rd, Southbank",4.5,Kim R,"Very enjoyable with a menu that catered for all tastes.  Fresh local produce from local suppliers including the Yarra Valley which was presented well and in a timely manner. The staff were attentive, friendly and treated us with care and respect.  The atmosphere was one of fine dining and relaxation. All within a reasonable price range.  If you are spending an enjoyable day at the art gallery, I can highly recommend the Tea Room for those breaks in between your viewing pleasure.  Communication from booking a table to requesting feedback on your visit is next level compared to other dining establishments. You will not be disappointed."
Top Tea,ChIJ9-XvpbBA1moRkux3qKJ1uAA,KI002/1 Main St Box Hill Central Shopping Centre,3.8,Sandy Ouyang,"The new pomelo ice tea is a disaster, I’ve never had any pomelo that bitter in my life. Just one little sip, you will have that bitterness in your whole mouth and last for a few minutes. Horrible drink. Also, there is no phone number to contact on their google review page, and the number on TOPTEA website have no one answering."
Top Tea,ChIJ9-XvpbBA1moRkux3qKJ1uAA,KI002/1 Main St Box Hill Central Shopping Centre,3.8,Tobey Nguyen,I like the tea but not the straw. For every tea latte you will receive a ridiculously small straw that you cant even enjoy the drink properly. It’s like sipping air.
Top Tea,ChIJ9-XvpbBA1moRkux3qKJ1uAA,KI002/1 Main St Box Hill Central Shopping Centre,3.8,Yolanda Rr,It’d probably be a good idea to give your staff a speaker for calling orders so customers won’t get rolled eyes for asking about missed numbers and having to suck the melt drink. I understand staff must be very stressed giving the long queue but no one wants pay over 10 dollars for this.
Top Tea,ChIJ9-XvpbBA1moRkux3qKJ1uAA,KI002/1 Main St Box Hill Central Shopping Centre,3.8,B,"I never jump on google just to complain about a drink, but thanks to topetea boxhill for ruining my favorite drink at toptea, and my day experience yall. $12 today was a solid stole.
I was looking forward for my pecan top, its all i wanted when ordering this drink, but i got NO PECANS but alot of pecan skins, thats has no crunch and flavor at all, ruining the whole texture and flavor of the drink, and is just annoying to to chew on. I did not ask the staff about this because i thought pecans would be underneath the flakey powdery skins, but no.
Also ur staff attitude is the worst comparing to all the milktea stores ive been to in Melbourne, the staff who took my order could not hide abit of her impatience, as if she’s superior 😅bro i just wanted to order a milktea, the one and only role that u had was take my order, and just go on, if u cant even put up with a normal customer for 1 sec when u take their order, then get out of hospitality and do something else, its not my fault u hate ur job😅😅😅
I was once spoiling toptea for its flavor, but the continued worsening is very much disappointing."
Top Tea,ChIJ9-XvpbBA1moRkux3qKJ1uAA,KI002/1 Main St Box Hill Central Shopping Centre,3.8,KiT (SillYKiT),Top tea is the best milk tea shop in Melbourne. They are introducing new limited time drinks or pastries every one to two months. My favourite from their all-time menu is coconut milk with black rice and mochi.
T2 Tea - Melbourne Central,ChIJW3_O6slC1moRlUFZyozn88Q,"Shop GD 049, Melbourne Central, 300 Lonsdale St, Melbourne",4.4,Zoe,Store is beautifully decorated and the Caucasian lady was really helpful. She wrapped the items for me and would revisit if I have the chance to. She was also helpful to recommend the tea that I was looking for as a gift. Thank you!
T2 Tea - Melbourne Central,ChIJW3_O6slC1moRlUFZyozn88Q,"Shop GD 049, Melbourne Central, 300 Lonsdale St, Melbourne",4.4,I. C.,"Really really disappointed about the customer service that I received  today.
I normally buy T2 and I even give T2 as gift to my family, but I won't anymore.
I came today at the store in Melbourne central and I was looking for a particular tea that I had one night with my girlfriend,  she didn't remembered the name of it but from the smell was or strawberry cream or  pack a peach. I asked for a sample which they normally give it to you, to making sure was going to be the exact tea for me to purchase and they said "" no we don't give sample anymore"" which is a lie because  at ringwood shopping center everytime I would like to try a new tea, I ask for a sample and than following the purchase.  It's $20 I want to make sure I like that tea. And she was not even trying to help me with my issue. Not happy at all."
T2 Tea - Melbourne Central,ChIJW3_O6slC1moRlUFZyozn88Q,"Shop GD 049, Melbourne Central, 300 Lonsdale St, Melbourne",4.4,Morgan Townsend,Amazing staff! Everyone there is so nice and welcoming! The ambience of the store is amazing! Everyone is so knowledgeable about teas! Their efforts in customer service doesn't go unnoticed!
T2 Tea - Melbourne Central,ChIJW3_O6slC1moRlUFZyozn88Q,"Shop GD 049, Melbourne Central, 300 Lonsdale St, Melbourne",4.4,shauna murtagh,"Went to this store yesterday on the 3rd of April at around 1pm. I was greeted with the most welcoming service I've encountered. The workers were so kind and funny, and at the time I was carrying a heap of heavy books in a paper bag, which embarrassingly ripped open when I was at the counter upon leaving. The woman at the front counter went out of her way to retrieve a new bag for me. I felt so bad that I offered to pay for it, and she insisted I didn't, and then proceeded to double bag it for added security for the trip home on the train. I never write reviews but 100% wanted to show gratitude for that act of kindness. I wish I had gotten a name, but she was this gorgeous woman with bangs. I purchased the mangoes and cream tea - absolutely delicious! I even tried it with that same lady's suggestion; iced and with fresh fruit - will definitely be my favourite for some time, and will definitely be back for these amazing products and exceptional service. Thanks so much! Your act of kindness will not go unnoticed."
T2 Tea - Melbourne Central,ChIJW3_O6slC1moRlUFZyozn88Q,"Shop GD 049, Melbourne Central, 300 Lonsdale St, Melbourne",4.4,JP T,"good atmosphere, all the staff are lovely."
LUPICIA Fresh Tea,ChIJz2N038tC1moReRO0bI1ndsk,"QV Shopping Complex, 14/16 Artemis Ln, Melbourne",4.6,C,"Bought the matcha black soybean rice tea here. Male staff was rude, felt like he did not want to be there. Asked where the matcha teas are and he just said “there” and continued with his stuff.
We picked our teas, paid (extra $4 for the can) and left.
Store was cute, lots of japanese teas and gift sets."
LUPICIA Fresh Tea,ChIJz2N038tC1moReRO0bI1ndsk,"QV Shopping Complex, 14/16 Artemis Ln, Melbourne",4.6,E L,"Ever since I ordered my first batch of tea from here in 2021, I have literally never bought tea anywhere else. This place is it.

Going into the store is a great experience - the owner is friendly, knowledgable and generous with his time, allowing you to smell each tea while you make your selections. He will also take the time to explain things to you and recommend teas according to your preferences.

He taught me an extremely important lesson about maximising flavour extraction from tea leaves by brewing first in a jug/mug, then pouring it into your drinking cup through a fine double mesh sieve (which they also sell here). My tea has never tasted better.

Online deliveries are super reliable as well and always arrive within a couple of days.

I cannot recommend this place enough. Just the best tea shop I’ve ever been to, hands down."
LUPICIA Fresh Tea,ChIJz2N038tC1moReRO0bI1ndsk,"QV Shopping Complex, 14/16 Artemis Ln, Melbourne",4.6,Emma,"Lovely little tea shop, stocking high quality tea from a variety of places around the world, including China. The owner is very friendly and happy to help with suggestions and guidance. Super great spot to get gifts for friends, family or something for yourself!"
LUPICIA Fresh Tea,ChIJz2N038tC1moReRO0bI1ndsk,"QV Shopping Complex, 14/16 Artemis Ln, Melbourne",4.6,Alexandria,"I was super excited to come across this shop while in Melbourne - they have a really amazing range of teas from countries that are renowned for making wonderful tea. Having just visited China this year, and being astounded by the incredible quality and flavours of the tea there, it was exciting to come across a shop that stocks tea from China. Staff were friendly and happy to give recommendations. Great spot for a special gift too. Only suggestion is it would be cool to be able to buy a cup of takeaway tea to drink on the go! Can’t wait to visit again."
LUPICIA Fresh Tea,ChIJz2N038tC1moReRO0bI1ndsk,"QV Shopping Complex, 14/16 Artemis Ln, Melbourne",4.6,M C,"A very lovely tea shop! Has a great selection of tea that you can smell and choose from, and there is a minimum weight that you have to purchase for each tea.

They also sell tea cups and tea pots, and packaged tea in lovely tins, which will be a perfect gift for tea lovers.

Highly recommend that you visit this shop the next time you are in the city."
MBT-My Bubble Tea-Australia No.1 DIY Bubble Tea Kits,ChIJ4Qch3WY71moRj9F2AwHPlwE,"66 Parkhurst Dr, Knoxfield",4.9,Xianjing Huang,"This was a great purchase. Love every sip of it, It turns out much better than the bubble tea shops.  We follow the instructions and use fresh milk, taste much better and healthier! Will continually buy more!"
MBT-My Bubble Tea-Australia No.1 DIY Bubble Tea Kits,ChIJ4Qch3WY71moRj9F2AwHPlwE,"66 Parkhurst Dr, Knoxfield",4.9,Jessie Lin,MBT bubble tea kit is 5 stars all the way! I ordered for a friend's birthday & it was the perfect gift. She loved it & sent me photos all day on how happy she was to receive which made my day!
MBT-My Bubble Tea-Australia No.1 DIY Bubble Tea Kits,ChIJ4Qch3WY71moRj9F2AwHPlwE,"66 Parkhurst Dr, Knoxfield",4.9,zhen li,The customer service of my bubble tea is great! The signature milk tea with tapioca pearls is one of my favourite drinks. Also the tropical green tea is very delicious! Highly recommend! 5 star experience!
MBT-My Bubble Tea-Australia No.1 DIY Bubble Tea Kits,ChIJ4Qch3WY71moRj9F2AwHPlwE,"66 Parkhurst Dr, Knoxfield",4.9,Rong Chen,"This was a great purchase. It was exactly what we needed since we weren't able to get out and enjoy Boba. Just as advertised, fast delivery"
MBT-My Bubble Tea-Australia No.1 DIY Bubble Tea Kits,ChIJ4Qch3WY71moRj9F2AwHPlwE,"66 Parkhurst Dr, Knoxfield",4.9,Huayi Yao,So yummy! Clear directions. Perfect DIY kit for boba lovers when all the local shops are closed for quarantine.
Palgong Tea Australia,ChIJiUe5FZ5p1moRyhHPPwVZ4Bc,"474 Centre Rd, Bentleigh",4.5,Lakesha James,"They forgot my cream cheese foam on two different occassions and it's definitely full sweetness when I asked for half.

What is the point in customisability if they keep getting it wrong. I've only been there twice and it's been a mess up every time. Wasted my money and my friend was driving me, by the time we got home and realised my order was messed up it was too late to go back.

I may avoid them in the future."
Palgong Tea Australia,ChIJiUe5FZ5p1moRyhHPPwVZ4Bc,"474 Centre Rd, Bentleigh",4.5,Danielle CLARKE,"My daughter and I went exploring around the Bentleigh Shopping Strip and saw the sign for Palgong Tea. We got excited when we saw at the bottom of the street board say Korea's finest bubble tea. I ordered the Banana flavoured tea. It was yummy 😋 I would definitely recommend visiting if you are in the area. Great staff, very friendly and you will leave smiling 😃"
Palgong Tea Australia,ChIJiUe5FZ5p1moRyhHPPwVZ4Bc,"474 Centre Rd, Bentleigh",4.5,Kenneth Lee,"🧋🧋🧋🧋🧋REFRESHING AND DELICIOUS

We ordered the lychee black tea with pearls and it really hit the spot!! The staff were extremely friendly and accomodating and the setting of the cafe was clean, modern and inviting.

Highly recommend visiting this gem in Bentleigh especially when bubble tea stores are scarce in the area - can’t wait to revisit!"
Palgong Tea Australia,ChIJiUe5FZ5p1moRyhHPPwVZ4Bc,"474 Centre Rd, Bentleigh",4.5,Sarah Melbs,"@palgongtea.australia 📍 With 200 stores worldwide I can’t believe I didn’t know this was in melbourne 😄🇰🇷🧋This South Korean BBT chain is the first of its kind to land here 🇰🇷🇦🇺 highly recommend the k- classics including the banana milk tea😄🍌 as well as the refreshing Korean grape soda ade🍇!!

the menu is v reasonably priced imho starting from $4.90+ 🤯 Highly recommend if you’re keen to try a Korean style bubble tea! 🇰🇷🧋🫰🏻They were so busy with locals! The line was insane. there’s seating out the back too!"
Palgong Tea Australia,ChIJiUe5FZ5p1moRyhHPPwVZ4Bc,"474 Centre Rd, Bentleigh",4.5,Yu Kim,"Best tea place in town!! I’ve been there a couple of times with my friends and family. The staffs were friendly and really helpful. They make sure that everyone feels comfortable and answer all the questions I asked for the menu. You must try the Green grape Ade!! It is refreshing and freezy🤍💚🤍💚 Also, my best drink from Palgong tea is YOGURT SMOOTHIE!! Absolute favourite❤️"
Gotcha Fresh Tea - Watergardens,ChIJOYAz56311moRb7poqSfYp0k,"399 Melton Hwy, Taylors Lakes",4.7,Tia Alysse,"I ordered Gotcha’s Brown Sugar Milk Tea with Pearls, and it was delicious from start to finish, so much that I got another one before I went home.
The pearls were exceptionally fresh, and the staff we’re really friendly and kind.
I’ll definitely be stopping here every time I go to Watergardens."
Gotcha Fresh Tea - Watergardens,ChIJOYAz56311moRb7poqSfYp0k,"399 Melton Hwy, Taylors Lakes",4.7,SusutheChen,"It was a great quality taro milk bubble tea. The pearls were cooked to perfection, boasting an ideal level of elasticity that strikes a delightful balance.😋"
Gotcha Fresh Tea - Watergardens,ChIJOYAz56311moRb7poqSfYp0k,"399 Melton Hwy, Taylors Lakes",4.7,jeannie wong,The Boba are so soft!! Good service! Always our go to bubble tea!
Gotcha Fresh Tea - Watergardens,ChIJOYAz56311moRb7poqSfYp0k,"399 Melton Hwy, Taylors Lakes",4.7,Kristina Muzoska,Black Sugar Pearl Fresh Milk and Golden Passionfruit Green Tea so fresh and full of flavour!
Gotcha Fresh Tea - Watergardens,ChIJOYAz56311moRb7poqSfYp0k,"399 Melton Hwy, Taylors Lakes",4.7,Anisa Anwar,"Great drinks, lovely staff. I had the lychee green tea and thoroughly enjoyed it, will definitely be trying other flavors next time!"
Popping & Tea Deer Park,ChIJi7Dk2QCL1moROgQ73bMzT-k,"817 Ballarat Rd, Deer Park",4.3,Mary Jade,"Favourite Bubble Tea place by far, my kids love it too. Great flavour, not too much ice. Fave is the coconut milk tea. Is definitely a must!! Always greeted by friendly and lovely staff. Fast and efficient service."
Popping & Tea Deer Park,ChIJi7Dk2QCL1moROgQ73bMzT-k,"817 Ballarat Rd, Deer Park",4.3,Lanni,"Been here about 3 to 4 times.

Last time the oolong milk tea made was rich however tonight the oolong milk tea I ordered tasted soooo watery. I can’t taste the tea properly.

I’d recommend to train your staff to make the milk tea ratio correctly."
Popping & Tea Deer Park,ChIJi7Dk2QCL1moROgQ73bMzT-k,"817 Ballarat Rd, Deer Park",4.3,Taliah Yasmine,"My favourite boba shop and franchise in all of Melbourne. While it is a little more expensive than your other popular bubble tea shops around, their handmade boba pearls and premium taste in their drinks totally makes it worth the price. The staff are always friendly, greeting you every time you walk in and when you leave. I highly recommend to treat yourself to Popping and Tea boba if you ever walk past one!"
Popping & Tea Deer Park,ChIJi7Dk2QCL1moROgQ73bMzT-k,"817 Ballarat Rd, Deer Park",4.3,jian,this review is written out of anger but I ordered drinks for my group of friends and I and they didn’t put any straws in the bag? We all had boba so we can’t drink with regular straw! Honestly so annoying!
Popping & Tea Deer Park,ChIJi7Dk2QCL1moROgQ73bMzT-k,"817 Ballarat Rd, Deer Park",4.3,Andrea Tran,I alway been a fan of jasmine milktea and strawberry green tea from popping & tea 😭😭💕💕💕 their handmade pearl alway got me melted with its chewy and sweet taste. If you have a chance please come to the shop. The staff was super friendly and nice. They offer free upside when u order directly from the store from mon to fri toooo :33 come here once and im sure you gonna crave for moreeee ❤️❤️❤️
御黑堂The Yunique Tea Docklands,ChIJ3fp1Fb5d1moR7XjGlzzyCa8,"Shop TM-GK03, 90 Waterfront Way, Docklands",4.5,GossipGirl XOXO,"updated:
I had a bubble tea today. The tapioca pearls were still hard. Could not even be chewed!

This is the last time to try!

——

The tapioca pearls are way too hard.
Very average.
3 stars are for the staff, they are very nice (sorry I have to downgrade the review from 3 to 1 star!)"
御黑堂The Yunique Tea Docklands,ChIJ3fp1Fb5d1moR7XjGlzzyCa8,"Shop TM-GK03, 90 Waterfront Way, Docklands",4.5,Christina Dang,"I decided to try Yunique for the first time and ordered five drinks. To my surprise, the employee told me it was too much. When I asked what she meant, she reiterated that it was too much. I was left confused—I’ve never been to a place where ordering their products was considered excessive.

The employee got visibly stressed and annoyed by my order. It’s crazy to me because I’m supporting the business and giving them money. While she did take my payment, her attitude and the level of customer service I received were unlike anything I’ve ever experienced. The drinks were okay, but not the best. I will not be coming back. It seems like they’re just open for decoration, not to actually take orders or sell stuff."
御黑堂The Yunique Tea Docklands,ChIJ3fp1Fb5d1moR7XjGlzzyCa8,"Shop TM-GK03, 90 Waterfront Way, Docklands",4.5,樱木花,"Bubble tea - black sugar Pearl with matcha.
Always wanting to try out new bubble tea.
This is yet another one. Hidden in the mall but would see it if you go to Woolworths.
Little pricey but you get to decide sugar level which is sometimes rare with other bubble tea store. But less ice ended up with no ice and not cold enough.  Pearls are Q… and tasty though!!!!"
御黑堂The Yunique Tea Docklands,ChIJ3fp1Fb5d1moR7XjGlzzyCa8,"Shop TM-GK03, 90 Waterfront Way, Docklands",4.5,Sreerag Nampoothiri K,"I think it’s safe to say, this is the only bubble tea place in docklands. Located in the close proximity of the mall, makes it an easy choice to go for and to have something to sip while you take a walk around. The lady at the store was extremely polite and she was very friendly. I have tried the Brown Sugar Milk tea and the pearls were very nice."
御黑堂The Yunique Tea Docklands,ChIJ3fp1Fb5d1moR7XjGlzzyCa8,"Shop TM-GK03, 90 Waterfront Way, Docklands",4.5,Ashley Jenny W,"Tried this cute bubble tea shop for the first time since it's nearby, and it didn't disappoint! The pearls were fresh and just the right amount of chewy. The milk tea was yummy too! Didn't love the grapefruit tea as much as the syrup tasted too artificial for my liking. But will definitely be back to try their other fruit flavours!

The staff were friendly, quick and professional too! Here's hoping them all the best - this side of Docklands needs its own staple bubble tea shop!"
Boba Tea,ChIJmfre9Spe1moRqQw6hVDWBdI,"233 Hampshire Rd, Sunshine",4.1,F Oeij,Very good Vietnamese coffee.. perfect place sitting outdoor with Vietnamese ice coffee and ciggies
Boba Tea,ChIJmfre9Spe1moRqQw6hVDWBdI,"233 Hampshire Rd, Sunshine",4.1,Sa P,"some pretty standard boba, defs not gongcha or share tea standard but decent. Its $5"
Boba Tea,ChIJmfre9Spe1moRqQw6hVDWBdI,"233 Hampshire Rd, Sunshine",4.1,Judith,"My ultimate favourite Milk tea spot! They nail it every time with my milk tea flavours, and all their other items they sell here! Love the service! If I could I’d come here everyday!"
Boba Tea,ChIJmfre9Spe1moRqQw6hVDWBdI,"233 Hampshire Rd, Sunshine",4.1,Ange,Ordered a $8 half ice sugar cane juice which turned out to be full of ice and tasted like kumquat juice. Totally unacceptable!!!
Boba Tea,ChIJmfre9Spe1moRqQw6hVDWBdI,"233 Hampshire Rd, Sunshine",4.1,Guantong Wo,"love this place. it's quite and peaceful after 6pm, you can grab a drink and enjoy your company."
Tas Tea Bubbles,ChIJy2wB_44R1moRd7bM7UgtFk4,"55 Hallam Rd, Hampton Park",4.9,belle,"Drinks are always made fresh to order, love coming here! The owner is always so friendly. Definitely recommend the Taro and Avocado coconut milk :)"
Tas Tea Bubbles,ChIJy2wB_44R1moRd7bM7UgtFk4,"55 Hallam Rd, Hampton Park",4.9,Human,"Excellent brown sugar milk tea with creme Broulee. The pearls were also extremely soft and nice, compared to most bubble tea places.

Super friendly owner as well!"
Tas Tea Bubbles,ChIJy2wB_44R1moRd7bM7UgtFk4,"55 Hallam Rd, Hampton Park",4.9,Z H,"Honestly a great place, the owner was super lovely and the drink was really good. he was very professional and when i mentioned that i wasn’t a fan of sweet drinks, even though i forgot to ask for less sugar he automatically did it and got me to see if i liked it. which i really appreciated as it was perfect! highly recommend :))"
Tas Tea Bubbles,ChIJy2wB_44R1moRd7bM7UgtFk4,"55 Hallam Rd, Hampton Park",4.9,Angela Roybal,"Drinks are made fresh and are absolutely delicious! The couple who run the shop are so lovely, if you’re in the area or a local, this should definitely be your go to boba shop!!

You may need to wait a little but what’s a little wait time compared to a delicious drink? Come visit ASAP

I always order their fresh Taro Milk Tea but all their drinks are great"
Tas Tea Bubbles,ChIJy2wB_44R1moRd7bM7UgtFk4,"55 Hallam Rd, Hampton Park",4.9,cheung yat ming,"We tried their taro pearl milk tea and cannot forget how tasty it is, we bought a pearl milk tea from other shop at the same time to compare, and we definitely can say this shop has the best taro milk tea which is made from real taro, you can definitely taste the freshness and rich in flavor."
Mr.Panda Bubble Tea,ChIJWepf33MP1moRpQtr-1S3KEk,"Cranbourne Park Shopping Center Food court (SP005, Cranbourne",4.1,Adeline,"Been coming here since it first opened!

The atmosphere of the shopped has improved since! Seating is available if you wish to sit inside, self serve board is readily accessible and of course when you can’t decide what bubble tea, smoothie/frappes and egg waffles you want… their are plenty of posters and menus to help you.

The staff are always super friendly and do their absolute best to make the best drinks to your liking.

100% recommend over chatime."
Mr.Panda Bubble Tea,ChIJWepf33MP1moRpQtr-1S3KEk,"Cranbourne Park Shopping Center Food court (SP005, Cranbourne",4.1,Nixxy Chan,"I love the way they have done up the place and the menu was so cute! The drink was really good, I loved the packaging too. I would recommend!"
Mr.Panda Bubble Tea,ChIJWepf33MP1moRpQtr-1S3KEk,"Cranbourne Park Shopping Center Food court (SP005, Cranbourne",4.1,Tionne Lee Driscoll Bartel,Omg I love panda tea especially the mouse cake range so delicious! Definitely try it out - friendly staff also at Cranbourne Park :)
Mr.Panda Bubble Tea,ChIJWepf33MP1moRpQtr-1S3KEk,"Cranbourne Park Shopping Center Food court (SP005, Cranbourne",4.1,Lanny kurnia,"I really love it . So yummy and Tasty ;)
Good price ;) good service ;) highly recommanded ❤️"
Mr.Panda Bubble Tea,ChIJWepf33MP1moRpQtr-1S3KEk,"Cranbourne Park Shopping Center Food court (SP005, Cranbourne",4.1,yuan wei,Best bubble tea in Cranbourne Park. The lady serviced us is friendly. Highly recommend!
