Name,PlaceID,Address,Rating,Author,Review
Serenity Teahouse,ChIJsRdOsLBA1moR0pzzZJjJNjA,"Shop SP023A, Box Hill Central (North, 17-21 Market St, Box Hill",4.9,Maria Ngo,A really good selection of quality Taiwanese teas that the connoisseur is due to appreciate. You can sample the tea before you purchase it. Real rose petals from France as well as ginger slices for use in tea. Helpful staff.
Serenity Teahouse,ChIJsRdOsLBA1moR0pzzZJjJNjA,"Shop SP023A, Box Hill Central (North, 17-21 Market St, Box Hill",4.9,Lena Boros,What a gorgeous little tea shop / with all your favourite tea cups & pots / Great Gift ideas for Friends & Family!! In Box Hill pay a visit!! Serenity Teahouse/ nice Lady in Shop!!
Serenity Teahouse,ChIJsRdOsLBA1moR0pzzZJjJNjA,"Shop SP023A, Box Hill Central (North, 17-21 Market St, Box Hill",4.9,My Retro Game Hub,"There’s a huge range of all sorts of teas, from green, oolong, black, white and herbal teas. Specializes in Taiwanese teas and authentic purple clay tea pots and bamboo tea sets. A must go for all tea connoisseurs."
Tea Room at National Gallery of Victoria,ChIJi3CHtLFC1moRqA2FGIKKHXo,"180 St Kilda Rd, Southbank",4.5,Brooklyn B,"Simply incredible! We enjoyed the high tea with champagne. Everything was incredible. All the food was beyond amazing. We were treated with care and respect. The customer service was next level! I hope the waiters and chefs are paid very well, they all deserve it. Thank you so so much."
Tea Room at National Gallery of Victoria,ChIJi3CHtLFC1moRqA2FGIKKHXo,"180 St Kilda Rd, Southbank",4.5,Lucien Lim,"A great place to sit and chat with friends and loved ones after visiting the NGV. While the food and tea weren’t anything special, the service was so good that it made the food and drinks taste better. In particular, our main server was extremely courteous and friendly, really brightening up our day.

A lovely experience overall, highly recommended!"
Tea Room at National Gallery of Victoria,ChIJi3CHtLFC1moRqA2FGIKKHXo,"180 St Kilda Rd, Southbank",4.5,Gina,"Yum yum, 🥂 club sandwiches, savory pastries, the most delicious little sweet treats topped off with Tea, scones, Jam & cream. With a nice walk around NGV. Who would have thought this little place existed 😍"
Tea Room at National Gallery of Victoria,ChIJi3CHtLFC1moRqA2FGIKKHXo,"180 St Kilda Rd, Southbank",4.5,Bronwyn Dajczer,"Fabulous experience of High Tea @NGV. It was busy as it's the Christmas/New Year break but we were warmly greeted, served with grace and the food was delicious.
The Champagne was creamy and refreshing, the only fault was the thick glassed flute. The food was amazing and just enough without being too much to enjoy.
Definitely recommend this treat 💕"
Tea Room at National Gallery of Victoria,ChIJi3CHtLFC1moRqA2FGIKKHXo,"180 St Kilda Rd, Southbank",4.5,Kim R,"Very enjoyable with a menu that catered for all tastes.  Fresh local produce from local suppliers including the Yarra Valley which was presented well and in a timely manner. The staff were attentive, friendly and treated us with care and respect.  The atmosphere was one of fine dining and relaxation. All within a reasonable price range.  If you are spending an enjoyable day at the art gallery, I can highly recommend the Tea Room for those breaks in between your viewing pleasure.  Communication from booking a table to requesting feedback on your visit is next level compared to other dining establishments. You will not be disappointed."
JSY Tea Westfield Doncaster,ChIJH4aNTKxH1moR2AOHII47EEo,"Westfield Shopping Centre, G151/619 Doncaster Rd, Doncaster",4.9,hoi yiu wong,"Great shop with great teas! Enjoyed the tea tastings and the experience of watching them brewing the teas in traditional ways.
They do serve very good Matcha and Oolong teas which are my favourites! I ordered their Organic Tea Ceremonial Grade Matcha Latte and it’s the best matcha I’ve ever had…
I tried their new arrival Peach oolong as well, and its natural flavor is just as same as a real peach!"
JSY Tea Westfield Doncaster,ChIJH4aNTKxH1moR2AOHII47EEo,"Westfield Shopping Centre, G151/619 Doncaster Rd, Doncaster",4.9,Yao Bob,"I went to meet a friend in Doncaster today and found this JSY TEA very interesting. The environment is great and it's real Chinese tea, not Bubble tea. ordered a hand made brewa tea and a cold brew tea, the taste is great, it's really made from very good tea leaves, not the industrialized product made from tea leaf powder that Bubble tea uses.
The service staff was very nice and introduced a lot of tea knowledge. It is a very interesting store."
JSY Tea Westfield Doncaster,ChIJH4aNTKxH1moR2AOHII47EEo,"Westfield Shopping Centre, G151/619 Doncaster Rd, Doncaster",4.9,nib,Sweet and knowledgeable staff who offer samples and recommendations when you need it :) Pleasant and warm environment with large range of teas and tea-wares to browse and choose from!
JSY Tea Westfield Doncaster,ChIJH4aNTKxH1moR2AOHII47EEo,"Westfield Shopping Centre, G151/619 Doncaster Rd, Doncaster",4.9,Ester Glucose,"A very nice Taiwanese tea shop! They have a wide selection of tea, and the staff members have great expertise. The cold brew osmanthus oolong tea for takeaway was incredible, crazy fragrance and tastes great - Would recommend"
JSY Tea Westfield Doncaster,ChIJH4aNTKxH1moR2AOHII47EEo,"Westfield Shopping Centre, G151/619 Doncaster Rd, Doncaster",4.9,Y.H. Lin,"Today I randomly wandered on the ground floor and was attracted by the aromatic and adorable decorations of this Taiwanese tea house, JSY Tea. I knew this brand since the Taiwanese director hosts a podcast sharing tea stories.
They currently invite customers to have a free lucky draw upon entry. I got a “Si ji chun Oolong” with a warm blessing “Wishes granted”. The staff invited me to experience the process of tea brewing, explained the tones and benefits of oolong, and let me enjoy the tea with elegant tea set.
As a Taiwanese, I feel they are enthusiastic about bringing authentic and premium quality tea to customers overseas. I enjoyed the moment of tasting my favourite teas and connecting the tastes and flavours to my life experiences…haha that’s right! Plenty choices in JSY Tea provides so many wonderful teas that can challenge taste buds. I would say this is a treasure place for tea lovers:)"
Naröcha Premium Tea Room,ChIJayB8xoyF1moRtq-zbh1HxDI,"Shop 3a/133 Watton St, Werribee",4.6,Rouven Grossmann,"Good place to grab a matcha latte and some sweet treats.
Enjoyed the coconut pandan cake a lot💥💥💥💥💥.
Can’t wait to try the other sweets there.
They also offer a range of cakes and bubble teas."
Naröcha Premium Tea Room,ChIJayB8xoyF1moRtq-zbh1HxDI,"Shop 3a/133 Watton St, Werribee",4.6,venice min,I can’t believe that can served out to customers. Tasted strong chemicals favored As you can see the photos ！Worst drink! Never ever had in my life. If you can’t make this flavor don’t make it . Disgusting taste
Naröcha Premium Tea Room,ChIJayB8xoyF1moRtq-zbh1HxDI,"Shop 3a/133 Watton St, Werribee",4.6,Shandy Mae,I was randomly craving bubble tea and ordered at Narocha because of their cakes and variety of bubble tea flavors!!!! They did not disappoint 🫶🏻🫶🏻 My first time ordering here but it certainly won’t be the last. Thank you to the lovely staffs for the sample of your matcha strawberry cake 🍰❤️ It made my day so much better!!
Naröcha Premium Tea Room,ChIJayB8xoyF1moRtq-zbh1HxDI,"Shop 3a/133 Watton St, Werribee",4.6,Suvarna Lee,"This is hands down the best tea place in Melbourne!!! And that’s massive considering I have tried such a large variety of bubble teas! The staff are amazing and their service is just outstanding. The place is large enough to sit down, enjoy your milk or fruit teas and settle into a delicious small cake! Their cakes are fantastic too! The flavours of tea and cakes are endless but I recommend the grape and vanilla, mango and pandan or mango and Thai milk tea cake! Just yummm!"
Naröcha Premium Tea Room,ChIJayB8xoyF1moRtq-zbh1HxDI,"Shop 3a/133 Watton St, Werribee",4.6,Mel K,"Such a little gem for anyone who love bubble tea. This unique shop had lots of Japanese variety and Malaysian flavor as well as usual bubble tea varieties. Finally hojicha is on the bubble tea menu. They use A2 milk for their tea, which can suit for everyone. They also made the Japanese branded powder for their Japanese tea. This tea shop menu show luxury feeling with usual price. Love this tea shop so much. Plenty of indoor seating and very spacious. Social distance definitely not an issue at all. Very close to train station and located on the main street. Plenty of parking around. Stuff are very helpful to explain their menu. I definitely will come back for other menu :)"
CHOULEE 丘丘茶,ChIJcbN6GyFD1moRoxmQlauBtJc,"249-251 Lonsdale St, Melbourne",4.6,Chau Tran,"The drinks were great. I’d love to try other drinks at Choulee later. But, the staff members were not friendly and welcoming with a cursoy attitude and no facial expression at all, although it was not busy at that time. I hope the store will take this into consideration and bring the customers better customer experience. ❤️"
CHOULEE 丘丘茶,ChIJcbN6GyFD1moRoxmQlauBtJc,"249-251 Lonsdale St, Melbourne",4.6,Leonard,"Really fun, clean, and vibrant atmosphere for bubble teas, yogurt drinks and more.
I ordered the people rice yogurt drink which was really good.

Aside from it being a tad bit more sweeter than I prefer and the rice being too small and not as cherry... all was good. I recommend the rice yogurt over Milk Flower place."
CHOULEE 丘丘茶,ChIJcbN6GyFD1moRoxmQlauBtJc,"249-251 Lonsdale St, Melbourne",4.6,Prashna Gautam,"I love this place, I've been here thrice. I ordered the passion fruit tea for the first try, which was sincerely my first time drinking a fruit based tea but the only thing I can say about it is that it was very refreshing in the 30 degree weather of Melbourne. The next two times I have ordered the Earl Grey tea, since it's my favourite tea base. I have enjoyed adjusting the sweetness level and the milk as I like less sugar or no sugar in my drink.
I brought a friend of mine along with me, who didn't find boba tea as appealing when we had it in other places but she loved this one. We went there today and I found that the quality of the drinks have been consistent which I have not found in other places, so I like this place + I can sit and talk with my friend while drinking tea. The staff at the front desk was also really friendly and the service overall was great... I'm looking forward to exploring more flavours in the future, I love match and strawberries so maybe that'd be a good one to try..."
CHOULEE 丘丘茶,ChIJcbN6GyFD1moRoxmQlauBtJc,"249-251 Lonsdale St, Melbourne",4.6,v,visited here multiple times & so far the drinks have always been good quality! store interior is also aesthetic so it’s nice to chill inside. drinks have always been served quite fast too! recommended to try :)
CHOULEE 丘丘茶,ChIJcbN6GyFD1moRoxmQlauBtJc,"249-251 Lonsdale St, Melbourne",4.6,Brissy Reviews,Such a cute bubble tea shop. Mu sister and I loved it. It was a bit hard to find using apple maps but that might have been my phone.
Hopetoun Tea Rooms est. 1892 (TM),ChIJBaUBTrRC1moRNdF-YqUyESg,"421 Bourke St, Melbourne",4.2,Raelyn M,"Enjoy their desserts, have tried most of their cakes. Really good not too sweet and pairs well with tea.

It can be a bit pricey and the space is quite cramped. Hence I think the staff may rush you once you’ve finished your food."
Hopetoun Tea Rooms est. 1892 (TM),ChIJBaUBTrRC1moRNdF-YqUyESg,"421 Bourke St, Melbourne",4.2,Pri Brabec,"The atmosphere, cakes, teas…everything is so delightful. My favourite is the Black Forest cake and Snow White Tea."
Hopetoun Tea Rooms est. 1892 (TM),ChIJBaUBTrRC1moRNdF-YqUyESg,"421 Bourke St, Melbourne",4.2,KE BILL,"A very suitable place for afternoon tea with friends. Although the internet here is not stable, the tea is very drinkable and the cakes are not too sweet."
Hopetoun Tea Rooms est. 1892 (TM),ChIJBaUBTrRC1moRNdF-YqUyESg,"421 Bourke St, Melbourne",4.2,Ashley Schmidt,"Visited Hopetoun Tea Rooms in Aug 2023 on a friends recommendation.
Awesome visit with the Mrs, great combo of food to have with the must have teas. Such a diverse selection of teas to choose from.
Staff were friendly and very helpful.
Would def recommend this place for a couple to have some chilled time with each other."
Hopetoun Tea Rooms est. 1892 (TM),ChIJBaUBTrRC1moRNdF-YqUyESg,"421 Bourke St, Melbourne",4.2,Aruneema Das,"Its an iconic Melbourne institution located at the Block arcade in cbd. The gorgeous cake display window & the classic decor always lures the crowd for photos and a taste. We had lemon meringue pie & red velvet roulade with coffee, enjoyed every bit of it."
Amazing Graze Tea Rooms,ChIJlVoyxpJd1moR5jWnk8NO-to,"524 Mt Alexander Rd, Ascot Vale",4.2,tashstar75,"We had a beautiful High Tea this morning! The food was delicious and fresh, so many tea choices (French earl grey is lovely!), and the service was quick and attentive. The venue is very pretty. We really enjoyed our experience, thank you 💖"
Amazing Graze Tea Rooms,ChIJlVoyxpJd1moR5jWnk8NO-to,"524 Mt Alexander Rd, Ascot Vale",4.2,Justin Hawke,"Possibly the most disappointing high tea I've ever experienced (having had in excess of forty over the past few years). The service was adequate, with food and tea brought promptly (granted, we were the only customers there). The seating and decor are quite lovely, with the scent of flowers wafting from the adjoining flower shop.

However, the main issue - and it's a significant one - is the quality and quantity of the food. For $70 per person, we only received two rather tasteless sandwiches each, a dry bao and a miniscule arancini ball as savouries. Sweets only consisted of four (two each) small macarons. There was also one scone each, which was fine. Needless to say, for the price paid this was an incredibly meagre serving. Would not recommend unless considerable changes were made in this area."
Amazing Graze Tea Rooms,ChIJlVoyxpJd1moR5jWnk8NO-to,"524 Mt Alexander Rd, Ascot Vale",4.2,Angela Kliendienst,Gorgeous mini high tea. The staff are super friendly and the food is very tasty. Russell even gave my mum a bouquet after knowing she’s leaving Australia soon. Wonderful experience and will definitely come back.
Amazing Graze Tea Rooms,ChIJlVoyxpJd1moR5jWnk8NO-to,"524 Mt Alexander Rd, Ascot Vale",4.2,Jessica W,"Had a reservation booked for 9 people. Was told the night before that the address had changed from Essendon to Ascot Vale. Venue isn't finished, half empty, tradies walking in and out as it is still under construction.

We sat on stained chairs, and at plastic trestle tables with a sheet of foam laid on top, covered with a tablecloth. Bathroom was filthy and had to walk through the construction zone to get there.

Arrived at 10, didn't receive our drinks until after 11.15, didn't receive food until close to 12. We let them know in advance one of our party has allergies, they didn't have food prepared separately for him as they said they would. Even though we paid extra money to ensure he had separate food provided.

Minimal food for our party of 9 and not great quality. The platters came out half empty as they didn't have the scones ready yet. When the scones did come out, they were tiny and we only got 1 each. We all left hungry.

Staff were not apologetic at all, quite rude and defensive.  Extremely overpriced and overhyped experience, definitely won't be back."
Amazing Graze Tea Rooms,ChIJlVoyxpJd1moR5jWnk8NO-to,"524 Mt Alexander Rd, Ascot Vale",4.2,Justine Sales,"A fabulous space with the most beautiful staff! They made us feel special from the moment we stepped in and made our daughter’s 6th birthday absolutely unforgettable. Thank you Amazing Graze, we look forward to returning ASAP! 🩷"
Green Tea House,ChIJh0731NVC1moRPcB110IDBSo,"237 Elgin St, Carlton",4.5,Andre Medina,bloody amazing. defs not a trap house. if you are looking for traps do not go here. 🐀
Green Tea House,ChIJh0731NVC1moRPcB110IDBSo,"237 Elgin St, Carlton",4.5,Ravi Newman-Pache,"Great tea, amazing location. Truly a secret gem"
Green Tea House,ChIJh0731NVC1moRPcB110IDBSo,"237 Elgin St, Carlton",4.5,Angus “ang” Grant,I don't know this place but it seems ok. 4 stars
Green Tea House,ChIJh0731NVC1moRPcB110IDBSo,"237 Elgin St, Carlton",4.5,Barnaby Hayward,Just a really great place!
Green Tea House,ChIJh0731NVC1moRPcB110IDBSo,"237 Elgin St, Carlton",4.5,Katrina KS,Good stock lines
Preston Tea House,ChIJRQR2ZMNF1moR4SUWLhssCsQ,"Unit 7/2 Arthur St, Preston",5,Alyson Lima,Amazing
The Tea Rooms 1892,ChIJtVWcGztD1moRw7zA37a4_fg,"Shops 1 & 2 The Block Arcade, Collins St, Melbourne",3.8,Melissa Flowers,"Wow such a lovely welcoming and warm Tea House. Friendly professional staff. You are made to feel special from the moment you walk in. So many delicious treats and food to choose from. The tea is served with beautiful tea cups. The history makes it extra special and sends you back in time. We will be back next visit to Melbourne, thank you."
The Tea Rooms 1892,ChIJtVWcGztD1moRw7zA37a4_fg,"Shops 1 & 2 The Block Arcade, Collins St, Melbourne",3.8,"Mick, Duck and Bear","We loved our visit here. We arranged a High Tea for 3.The booking process was very easy with great communication.

Everything was ready for us when we arrived at our scheduled time, with linen table cloths and napkins with a lovely set table including fresh a fresh rose.

The selections of teas is fabulous but they also offer juice, coffee, cold drinks and lemon water.

The high tea stand is packed to the brim with fresh and yummy food, savory, sweet and fruit.  PLUS The fresh scones are amazing. Don't worry though what you don't eat the team package up so you can take home!

The team did an amazing job in checking in and offering their assistance. Super friendly and always willing to go the extra mile.

The rooms are delightful and full of charm. Although in the busy part of Melbourne the rooms are very peaceful and take you back in time.

We loved our time here are highly recommend you book a high tea experience."
The Tea Rooms 1892,ChIJtVWcGztD1moRw7zA37a4_fg,"Shops 1 & 2 The Block Arcade, Collins St, Melbourne",3.8,sakina amani,"This tea room isn’t worth a star. A banana bread and coffee from McDonald is a five star experience. I had a Mango Mousse slice here, yesterday. It was as if I’m eating a mud. The cake wasn’t fresh and looked like it has been stored from days before. I and other customers also saw a fly flying on top of the cakes in the front window, I immediately informed their staff about the matter.
When I provided my feedback about the cake and whatever I heard the day before about their process, today their management called me and in a very rude manner told otherwise - puzzled me who’s right/who’s wrong?
Looks like this tea room love to have insects on top of their cakes and we, the customers are wrong about their cakes and services completely.
Overall, this tea room is totally fake and lacks everything to deserve a good name. High-end name needs advanced effort and professionalism!"
The Tea Rooms 1892,ChIJtVWcGztD1moRw7zA37a4_fg,"Shops 1 & 2 The Block Arcade, Collins St, Melbourne",3.8,Rachel Maunder,"Arrived Friday mid morning with no reservation and blessed to be accommodated with indoor dining at historical tea rooms in Melbourne. We tried  sample of sandwiches and tea 🫖 to then explore the famous Block Arcade . Stunning decor and love the menu with history of the tea rooms . Especially loved reading a waitress who worked there back in the day was admired and investment of money established her to be first women to create successful cosmetics business, love reading fascinating tidbits of history. 5 stars 🌟 tea rooms"
The Tea Rooms 1892,ChIJtVWcGztD1moRw7zA37a4_fg,"Shops 1 & 2 The Block Arcade, Collins St, Melbourne",3.8,Travel Gen,"The Tea Room – Block Arcade, Melbourne

Stepping into The Tea Room in the Block Arcade is like stepping back in time into an era of elegance and charm. This extraordinary shop, dating back to 1892, is a true Melbourne gem that captures the essence of the city’s rich history.

We recently had the pleasure of sharing coffee in this remarkable setting, and it was an experience to remember. The ambience is nothing short of magical, with its ornate décor, high ceilings, and a timeless atmosphere that transports you to another world. It’s clear that The Tea Room has preserved its historical roots while offering a warm and welcoming space for visitors.

The coffee itself was exquisite, perfectly brewed, and served with a touch of class that matches the grandeur of the surroundings. Every sip was a reminder of why this place has stood the test of time—it's not just a café; it's a destination that offers a unique blend of history, elegance, and culinary delight

Whether you're a local or a visitor, The Tea Room in the Block Arcade is a must-visit. It’s more than just a place to enjoy a coffee; it’s an experience steeped in history and tradition, offering a taste of Melbourne’s past in the most extraordinary way."
Tea&Sympathy,ChIJs7H_JYlE1moRksns3CWjVAQ,"781 High St, Thornbury",5,Chris Mouratidis,I’m a repeat customer who has been impressed by the high quality teas on offer at a reasonable price. I really like the herbal and green teas on offer. The teas I’ve tried are so fresh you really notice the difference.
Tea&Sympathy,ChIJs7H_JYlE1moRksns3CWjVAQ,"781 High St, Thornbury",5,Martin Griffith,"An excellent range of teas chosen with care. Excellent service and good prices. If you are looking for quality Teas, this should be your first stop."
Tea&Sympathy,ChIJs7H_JYlE1moRksns3CWjVAQ,"781 High St, Thornbury",5,Jarrod Glasunow,Amazing teas and great service. Highly recommend A+++
St. Julien Tea House,ChIJ2-XxdSo11moRs9cOGKnd4e8,"359 Canterbury Rd, Surrey Hills",5,Julie Dunn,"I can not rate this gorgeous place highly enough! Taken here for a High Tea for my birthday.  Exceptional service, delicious food and a delightful ambience. Something to look at in every corner. Pretty and quaint. Unlimited coffee and beautiful teas of all kinds. Highly recommend for a special occasion or just a tea and a scone! Definitely won't disappoint. Thank you to the ladies of St Juliens tea house. A birthday to remember ❤️"
St. Julien Tea House,ChIJ2-XxdSo11moRs9cOGKnd4e8,"359 Canterbury Rd, Surrey Hills",5,Lullabye Behrendt,"What a gorgeous little place for afternoon tea tucked away in Surrey Hills.
The various blends all look and smell delicious however ‘Tease Me’ was a true winner for me with the smooth camomile complimenting the lavender perfectly.
Don’t miss out on the savoury menu either, the soup of the day was a Creamy Mushroom that was to die for, creamy and herby served on fabulous sourdough.
My friend ordered the Mushroom Crouque Monsieur which was perfectly flaky and cheesy with a bright fresh salad to accompany.
Incredible customer service from start to finish I couldn’t recommend this place more ❤️"
St. Julien Tea House,ChIJ2-XxdSo11moRs9cOGKnd4e8,"359 Canterbury Rd, Surrey Hills",5,Andrew Bartram,"Overall Experience: St. Julien Tea House offers a very pleasant experience, making it an ideal spot for a relaxed morning or afternoon. The ambience is charming, with a cosy, welcoming atmosphere that’s perfect for enjoying a leisurely breakfast or afternoon tea.

Food & Drink: The scones are absolutely delicious—light, fluffy, and served with fresh cream and jam. The tea selection is impressive, with a variety of blends that are beautifully presented and brewed to perfection. I particularly enjoyed their tea, which had a wonderful aroma and flavour.

Service: The service here is top-notch. The staff are attentive without being intrusive, always ensuring that your tea is perfectly steeped and your cup never runs dry. They’re also knowledgeable about the menu and happy to make recommendations.

Atmosphere: The tea house has a delightful, tranquil atmosphere, with elegant decor that makes you feel like you’re stepping into a different era. The seating is comfortable, and the soft background music adds to the relaxing environment."
St. Julien Tea House,ChIJ2-XxdSo11moRs9cOGKnd4e8,"359 Canterbury Rd, Surrey Hills",5,Lois Ferne,"What a lovely cafe , absolutely delicious scones freshly baked straight from the oven . They were really good !! We all had coffee and it was great , next time we will try the huge selection of teas . Definitely an excellent place for morning tea or lunch 😊"
St. Julien Tea House,ChIJ2-XxdSo11moRs9cOGKnd4e8,"359 Canterbury Rd, Surrey Hills",5,Andrea Beres,"Dearest Bethel and Bethan
Thankyou for an amazing 89th birthday high tea for my mum and family. All the amazing service, extras and quality did not go unnoticed… we will certainly return again and recommend your business highly. It’s hard to achieve the quality of food and service and and you exceed all expectations xxxx"
