Name,PlaceID,Address,Rating,Author,Review
Juliette Coffee & Munch,ChIJHSeDZf1B1moRHt7NrPyy3zM,"1 Russell St, Hawthorn East",4.4,G M,"Juliette Bakery has always been a favorite spot for me due to its efficient service and wide variety of delicious offerings. However, my recent visits have left me disappointed.

Since the change in ownership, there has been a noticeable decline in both the quality of the food and the service. The coffee, once rich and flavorful, now lacks the same appeal. The food quality has also suffered, and the once extensive variety seems to have diminished.

The service has become exceedingly slow. On multiple occasions, my orders took an unreasonably long time to be prepared. Additionally, there seems to be a lack of basic skills among the staff; they struggled with simple tasks like toasting a sandwich properly.

It genuinely feels bad to leave such feedback for a small business, but I hope this review serves as constructive criticism. Juliette Bakery has the potential to return to its former glory with some necessary improvements in both service and food quality. I truly hope to see positive changes soon

A reply to the owner:

Thank you for your feedback. While I disagree with the notion that leaving negative comments makes someone a sad person, I believe this platform is meant for providing honest reviews about businesses. I have also left positive reviews for places that I found truly amazing and continuously improving.

You have the right to disagree with negative feedback about your business, but I believe that acknowledging and addressing constructive criticism is essential for growth and improvement. Julian’s team (the previous owners) set a high standard for Juliette.

I hope you can see this feedback as an opportunity to enhance the quality of your services."
Puzzle Coffee,ChIJ64HO4H1d1moRofkkKD8rPNU,"Southern Cross, Spencer St &, Collins St, Docklands",4.3,Janelle,"Tried the iced cappuccino here which was recommended by the staff, it's SO GOOD! Liked how it has a layer of cream on top, plus their own Riddle coffee blend, overall tasted so smooth and it's just awesome!!🤍 Also got to try their Strawberry Matcha, Strawberry Yogurt and Yuzu Espresso Sparkling (seasonal specials), love the sparkling yuzu espresso the most, it was very refreshing but also not overpowering the taste of coffee. Will definitely come back again for their coffee🤤"
Puzzle Coffee,ChIJ64HO4H1d1moRofkkKD8rPNU,"Southern Cross, Spencer St &, Collins St, Docklands",4.3,Oracle Chow,"good place for a quick caffeine fix! very conveniently located, with friendly staff 💓

ordered:
✦ iced strawberry matcha ($8.00)
✦ hot hojicha ($5.50) + edible grain cup ($3)
✦ ham & cheese croissant ($7.50)
✦ peanut butter & choc cookie ($5.99)"
Puzzle Coffee,ChIJ64HO4H1d1moRofkkKD8rPNU,"Southern Cross, Spencer St &, Collins St, Docklands",4.3,Elle,"Amazing coffee and service!! Great place for a pit stop and reasonably priced too!
Not to mention the yummy snacks"
Puzzle Coffee,ChIJ64HO4H1d1moRofkkKD8rPNU,"Southern Cross, Spencer St &, Collins St, Docklands",4.3,서동훈,"The cafe was really blusting, so I wasn’t expecting much in terms of service, but the manager and staff were super friendly and quick. In addition, the coffee tasted good enough."
Puzzle Coffee,ChIJ64HO4H1d1moRofkkKD8rPNU,"Southern Cross, Spencer St &, Collins St, Docklands",4.3,Julie Egitto,"good coffee and have an option of edible cup.
was a good experience with the cup. just wish it the cup comes on different flavours, like cinnamon and honey or a chocolate one."
Puzzle Coffee Melbourne Central,ChIJcY8EpTtD1moRfdZIbMy-FX0,"140 La Trobe St, Melbourne",4.2,Leon Chai,"This coffee shop is an absolute gem! The interior decor is very distinctive, blending modern minimalism with vintage elements, making you feel incredibly comfortable as soon as you step in. The variety of coffee is impressive, catering to all tastes whether you prefer a robust espresso or a refreshing cold brew. I especially recommend their pour-over coffee, which has a delicate taste and a rich aroma, allowing you to savour the pure essence of the coffee beans. The desserts are also a highlight, each one meticulously crafted and delicious, particularly their cheesecake, which is creamy and melts in your mouth. Moreover, the staff are warm and attentive, always greeting you with a smile, making you feel right at home. Whether you're looking to relax alone or catch up with friends, this place is an excellent choice. In short, this coffee shop is well worth a visit and won't disappoint!"
Puzzle Coffee Melbourne Central,ChIJcY8EpTtD1moRfdZIbMy-FX0,"140 La Trobe St, Melbourne",4.2,Jen,"☕️COFFEE FIX☕️

Been meaning to try puzzle coffee for so long and it did not disappoint. I enjoyed all the drinks, but surprisingly I really liked their yuzu sparkling! The strawberry matcha wasn’t as strong as I would like and quite subtle in flavour. Overall a good spot to get a pick me up - I also got their white coffee which was perfect. 👌

Featured:
🍵 strawberry matcha
✨ yuzu sparkling
☕️ white coffee

Thank you for the invite."
Puzzle Coffee Melbourne Central,ChIJcY8EpTtD1moRfdZIbMy-FX0,"140 La Trobe St, Melbourne",4.2,Larc Justine Chan,Poor matcha taste. Almost tasteless. Even worse is their customer service. No enthusiasm and didnt feel like we were welcome.
Puzzle Coffee Melbourne Central,ChIJcY8EpTtD1moRfdZIbMy-FX0,"140 La Trobe St, Melbourne",4.2,Eat with Josephine,"I'm huge fan of puzzle coffee for when I want to indulge in an iced beverage because their variety is always good.

Having previously tried their strawberry matcha, I was eager to order it again. However, this time, there seemed to be a shortage of strawberries, throwing off the overall balance a bit.

On the other hand, hojicha, a personal favourite of mine, had a nice roasted flavour throughout. The yakult sparkling drink proved to be incredibly refreshing, hitting all the right spots, especially on the day we visited when the temperature soared to 35 degrees. To round off the experience, the croissant was light and crispy but fell into the category of being quite average, lacking any standout qualities.

I'd suggest giving their drinks a try since that's their specialty, despite some occasional inconsistency, they are still quite good! With multiple locations around Melbourne too.

Puzzle coffee was kind enough to invite me out to try out their menu."
Puzzle Coffee Melbourne Central,ChIJcY8EpTtD1moRfdZIbMy-FX0,"140 La Trobe St, Melbourne",4.2,Luong Gia Linh,Served by sweet Audrey! Best service ever
Twenty & Six Espresso,ChIJJ6dAgDld1moR7vxYo_MIx6E,"594 Queensberry St, North Melbourne",4.5,Kiah W,I don’t think I’ve ever taken pictures of food before this moment. 10/10 fish tacos and 10/10 limited iced strawberry matcha latte. Also fam’s latte art was exceptional
Twenty & Six Espresso,ChIJJ6dAgDld1moR7vxYo_MIx6E,"594 Queensberry St, North Melbourne",4.5,Hiromi,Pulled pork benny and latte were delicious. Cute latte art made me happy.  Cozy and nice atmosphere. Friendly staff. Highly recommended.
Twenty & Six Espresso,ChIJJ6dAgDld1moR7vxYo_MIx6E,"594 Queensberry St, North Melbourne",4.5,Hanmo Li,"Brunch at @twentyandsix from a few months ago: good brunch staples in a nice and cosy shop!
.
Zucchini and corn fritters with bacon: yummy fritters!.
Smashed avocado with poached egg
Matcha latte"
Twenty & Six Espresso,ChIJJ6dAgDld1moR7vxYo_MIx6E,"594 Queensberry St, North Melbourne",4.5,Habibah Ghazali,Love this cafe. The coffee always good and not overpriced. The food that we have tried are all yummy! The owner and his staff are very nice and friendly too! The best coffee in North Melbourne.
Twenty & Six Espresso,ChIJJ6dAgDld1moR7vxYo_MIx6E,"594 Queensberry St, North Melbourne",4.5,Olga Balaganskaya,"It's one of my favourite cafes. I love this place for their delicious and healthy dishes and a nice, quiet atmosphere.
Place features:
- Food and drinks.
- Breakfasts and lunches.
- Original serving.
- Moderate prices.
- Dogs friendly.
- Indoor and outdoor areas.
- Friendly stuff."
Overlay Coffee,ChIJ25x2xuFd1moRVl-vqCL_ZGo,"320 Little Lonsdale St, Melbourne",4.5,ShengJin,The store is not big but clean and tidy. The peanut latte is especially delicious. I drank it several times and the concentration of peanuts was different each time. But overall it is still very good.
Overlay Coffee,ChIJ25x2xuFd1moRVl-vqCL_ZGo,"320 Little Lonsdale St, Melbourne",4.5,Kwan Jason,"The drinks are fabulous!

Peanut Cream Latte is too much so try the peanut cream matcha, really good, trust me.

Limited space, can takeaway and city walk"
Overlay Coffee,ChIJ25x2xuFd1moRVl-vqCL_ZGo,"320 Little Lonsdale St, Melbourne",4.5,Harinduni Kannangara,"I wanted to see if this place lived up to the hype, and if you go for the Peanut Butter Cream Latte, I'd say it definitely does! It was my first time trying peanut butter in coffee, and it was creamy, delicious, and so satisfying.

The place was packed—everyone was there to try their coffees—but the service was impressively fast. Even with more than 10-12 people waiting, I got my coffee in under 4 minutes. Definitely worth trying the Peanut Butter Coffee!"
Overlay Coffee,ChIJ25x2xuFd1moRVl-vqCL_ZGo,"320 Little Lonsdale St, Melbourne",4.5,Gwen Lin,"Very popular cafe with warm staff and amazing peanut butter latte with oat milk for me. Usually wait a long line on the weekends, but not a long wait to get your cafe and breaks ! I would love to visit every week when I am in the CBD, highly recommended 👍"
Overlay Coffee,ChIJ25x2xuFd1moRVl-vqCL_ZGo,"320 Little Lonsdale St, Melbourne",4.5,Bảo Hân Phạm,"The first time I drunk peanut cream latte about two-three weeks ago that was totally perfect. The peanut was so condensed and the peanut taste was so obvious. But I feel like the recipe is quite different today and some previous days. I feel the cream was too washy and maybe less peanut? Although it is still good, I’m quite disappointed. I really miss the old taste 😭 it is not good as the first time."
Top Notch Coffee,ChIJAQDMY_Fc1moRp53rY7f0aHU,"2 Puckle St, Moonee Ponds",4.8,Patompon Putpipat,"coffee is so cheap. small flat white is just 4.
staff are so good. so friendly.
the cafe vibes also nice. near the tram stop so easy to just stop and grab coffee!"
Top Notch Coffee,ChIJAQDMY_Fc1moRp53rY7f0aHU,"2 Puckle St, Moonee Ponds",4.8,Mauro Miglino,"With infinite charm and an amazing vibe, Top notch coffee,is without a shroud of doubt,one of the best coffee shops in Melbourne,hands down. Enveloped by sheer opulence and impressive aesthetics, as well as offering the highest level of standards and professionalism,as well as pertinacity, the lovely and hard working staff members that work in this outstanding coffee shop,are passionate about their work, and will  incessantly go out of their way to ensure that they consistently provide the best coffees and food that you will ever experience in Melbourne. This high level of proficiency and standards as well as being pertinacious and diligent about their work and how they consistently serve their respective customers with the pinnacle of superlative skills and sublime professionalism, is in essence conducive in enhancing as well as elevating an amazing experience at coming to Top notch coffee to purchase their absolutely amazing food and sublime coffees. The staff that work at Top notch coffee are always so warm, friendly and accommodating, in fact so much so,that they even address their customers by their names, will always welcome them with a warm smile. In conclusion to my review, and in the interest of truth and veracity, if you are in dire need of experiencing some of the best coffees you'll ever have the pleasure of tasting in Melbourne, then I both highly and vehemently encourage that you try Top notch coffee, I can assure you will not be disappointed, the coffees here are on another level, and the staff are so sweet and friendly, not to mention some of the most proficient, passionate, diligent, and hard working people I have ever met,try this outstanding coffee shop, you will be so glad you did ❤️❤️❤️❤️❤️🙏🙏🙏🙏"
Top Notch Coffee,ChIJAQDMY_Fc1moRp53rY7f0aHU,"2 Puckle St, Moonee Ponds",4.8,Beau Tanton,"By far the best coffee in Moonee Ponds. Never too hot, smooth blend, service is impeccable, so friendly and welcoming. Food and treats are of the highest quality. Highly recommend."
Top Notch Coffee,ChIJAQDMY_Fc1moRp53rY7f0aHU,"2 Puckle St, Moonee Ponds",4.8,rebekah,"I came here because of the high reviews, I'm a chai lover and saw some people commented on how nice it was. the shop is so cute and clean, the staff are really friendly and knew names of customers. the whole place just had a friendly atmosphere to it

I was really let down by the drinks though, the chai didn't have much flavour to it, I wouldn't come back. my dad loves his coffees but also didn't really enjoy it from here

seems like a lovely store, if you're not too picky with your drinks it's nice to visit, but otherwise I'd recommend going elsewhere"
Top Notch Coffee,ChIJAQDMY_Fc1moRp53rY7f0aHU,"2 Puckle St, Moonee Ponds",4.8,Sydney Scott,Kevin is a legend! A coffee wizard if you will🤭 thanks so much for serving up some of the best coffee in Melbourne!
Path Melbourne,ChIJ93t4mu9d1moRvKVufTEv9U0,"362 Victoria St, North Melbourne",4.8,Chathura Perera,"Path is an absolute gem and arguably the finest brew bar in Melbourne. The moment you walk through the door, you’re enveloped in an ambiance that perfectly balances chic elegance with a homely charm. The coffee here is nothing short of exceptional—each cup is a masterpiece, brewed with meticulous care and a genuine passion for the craft. The menu is a delightful journey of culinary creativity, offering everything from heavenly pastries to delectable drinks that are as visually appealing as they are delicious. The staff exudes warmth and professionalism, enhancing the overall experience. Whether you're seeking a serene spot for a solo retreat or a vibrant venue for a gathering with friends, Path stands out as the epitome of café perfection. It’s not just a place to enjoy coffee; it’s a destination for an unforgettable experience. Melbourne is lucky to have Path!"
Path Melbourne,ChIJ93t4mu9d1moRvKVufTEv9U0,"362 Victoria St, North Melbourne",4.8,Narit Kimsat,"Best coffee in town, world class venue, exceptional service, vibrant atmosphere, their daily dessert selections are to die for. Bonus point for the venue cleanliness. I would give this place more than 5 stars if I could. Bonus bonus point their white coffee always got beautiful crèma. Tip top place not to be missed. ☝️"
Path Melbourne,ChIJ93t4mu9d1moRvKVufTEv9U0,"362 Victoria St, North Melbourne",4.8,Ricky,"Came here to enjoy the Path coffee experience. I started off with an espresso made with their Yunnan beans. It was refreshing, light, and floral with good acidity. I finished off with a pour over from their heavier Brazilian beans. It was quite floral with some good nutty flavour. The barista was friendly and gave me some insight into the espresso and pour over making. An overall pleasing experience on my coffee journey! Thankyou!"
Path Melbourne,ChIJ93t4mu9d1moRvKVufTEv9U0,"362 Victoria St, North Melbourne",4.8,pastelsparkles,"This place was SO interesting. We came to Path because my partner was looking for a more elevated coffee experience and we definitely got just that here.
The menu described the different drinks you could order here based on their notes, which was so fun.
It was definitely a more artisanal experience and I’m glad I’ve had enough nice coffee to feel like I could appreciate this place.
Definitely somewhere to visit if you want a beautiful coffee experience. We had a lot of fun here. The space was lovely and the coffee was amazing 🥰"
Path Melbourne,ChIJ93t4mu9d1moRvKVufTEv9U0,"362 Victoria St, North Melbourne",4.8,Huang Guangci,"1st visit (June 2023): Got a hot white to go, was a pleasant experience.

2nd visit (Aug 2024): got an iced latte and a iced black, dined in. service was cold, coffee was diluted and overall underwhelming. Melbourne has a really competitive coffee scene and this place is a skip. For better coffee, much friendlier service and less pretentious vibe, try Rosso instead… or maybe of the other places Melbourne has to offer"
Everyday Coffee,ChIJhb8hqx9D1moREUdvGRuSNic,"36-38 Sackville St, Collingwood",4.5,Amo Cereigido,"The best cinnamon roll I have ever had.
Vegan Bagel was quite expensive but also delicious. Super friendly service and great atmosphere!
:)"
Everyday Coffee,ChIJhb8hqx9D1moREUdvGRuSNic,"36-38 Sackville St, Collingwood",4.5,Martin Ryan,"if you drink tea don't bother, $6.06 for a measured 200 ml cup (apparently it looks tiny) and a side of milk, and no chance of deciding on your own brew strength. , It's $5.50 in the menu so was I charged 56c for the milk or was this a surcharge for using eftpos? The guy who served me was nice, not his fault,  but but If the owners really are worried about space being taken up by pesky tea drinkers with pots of tea I suppose it works, because I won't be back again! Also the bagels are definitely over priced, $24 for a big brekky bagel, when an actual big brekky elsewhere is probably the same price! definite thumbs down

addendum: turns out in the very small print at the the bottom of the menu there is a 10% surcharge for weekends, according to the ACCC this has to be at least as large as the most prominent price on the menu, and I didn't see it posted anywhere else in the cafe... I ordered at the counter and didn't have a menu to look at! I posted a pic of the menu, see if you would have noticed it!"
Everyday Coffee,ChIJhb8hqx9D1moREUdvGRuSNic,"36-38 Sackville St, Collingwood",4.5,Alana D (awholelattelana),Super friendly staff and cook and very chill atmosphere! Cook made me a special of the the carrot lox on its own as a side to takeaway so I could try it! Usually a couple offerings of batch brew and lovely with a side of oat milk! Some cute merch too including the sturdy Everyday mug and the bagu everyday tote bags! Recommended by Renee from Melbourne Vegan Guides! Have more vegan options these days
Everyday Coffee,ChIJhb8hqx9D1moREUdvGRuSNic,"36-38 Sackville St, Collingwood",4.5,Flashback Arrest,"I used to love this place. I've been going since they were on Johnson st. Today the heaters were off, the music too loud, the cappuccino was really bad and the avocado bagel bland 😞 I would've told them about it if I had been asked ""how was everything?"" before paying, but I wasn't."
Everyday Coffee,ChIJhb8hqx9D1moREUdvGRuSNic,"36-38 Sackville St, Collingwood",4.5,Nikki Liakos,Was served by the most loveliest person thank you jack (I think that was his name) he was the manager. Very friendly customer service and went out of his way to cater to us even though they were about to close was an absolute legend. Delicious food & coffee.
Xing Fu Tang Melbourne,ChIJE7SQMnhD1moRhB97Yer0oCM,"273 Elizabeth St, Melbourne",4,E L,"Rating solely based on their signature brown sugar boba milk - pretty good, but pearls are a bit soft (not sure if it’s because we ordered the drink warm), could be more bouncy. Could have also been more aggressive on the caramelised brown sugar flavour."
Xing Fu Tang Melbourne,ChIJE7SQMnhD1moRhB97Yer0oCM,"273 Elizabeth St, Melbourne",4,Helen Evangelina,"From creamy to refreshing, Xing Fu Tang has it all!

What I ordered:
🧋Signature Brown Sugar Boba Milk
🍵Matcha Boba
🥭Mango Smoothie and Panna Cotta
🥤Lychee Green Tea w/ Coconut Jelly
🧇Croffle w/ Biscoff Sauce

I usually don’t like boba pearls because they can be hard to chew, but I love XFT boba—they're so chewy and soft! The brown sugar boba is super milky and creamy, which I love.

The mango smoothie was refreshing - and look how cute the bunny panna cotta is🥹 If you love lychee, you would definitely love the Lychee Green Tea which was light and refreshing. My friend loves lychee and she loved it!

I was actually surpsied with the Matcha Boba because it has strong matcha flavor—most bubble tea shops don’t get it right, but this one did!

And the croffle was delicious!"
Xing Fu Tang Melbourne,ChIJE7SQMnhD1moRhB97Yer0oCM,"273 Elizabeth St, Melbourne",4,Yama Vikara,"I bought the croffle today to fill my sugar needs. Was a bit skeptical but turned out it was 10/10!! The croffle itself was crunchy outside but soft inside, just the right sweetness level for me. The sweetness from the syrup and biscoff crumble were on point to my taste and the whipped cream just balanced out the taste and texture on every munch!! Definitely a yes to the croffle and will buy it another time."
Xing Fu Tang Melbourne,ChIJE7SQMnhD1moRhB97Yer0oCM,"273 Elizabeth St, Melbourne",4,Vandana T Sivadas,Their bobo’s are always on the hot woke and thats the taste for your drink. Its a must try. I had croffle with biscoff sauce. Highly recommended. Brown sugar cooked bobos are the best. Must try
Xing Fu Tang Melbourne,ChIJE7SQMnhD1moRhB97Yer0oCM,"273 Elizabeth St, Melbourne",4,Anusha Karanayil,"I’ve tried quite a few bubble tea places and this one has easily become my favourite! They have so many creative drinks that taste so good! Pleased to say I will be a regular at this place from now on! I’ve tried the mango panacotta, Biscoff and the brown sugar bubble teas so far and they’re all equally delicious."
Gotcha Fresh Tea - Melbourne Central,ChIJF0qGqOBD1moRk-XdNWTs2WI,"L02-245/211 La Trobe St, Melbourne",4,Stelly,"Love the Hello Kitty collaboration! Their large drinks come in cute Hello Kitty cups and they have lots of Hello Kitty character merch - including tumblers, drink bottles, etc.

Their fruity drinks are my favourite - especially the Golden Passionfruit and the signature Fruit Tea! Super refreshing 😍

This location even has seating areas!"
Gotcha Fresh Tea - Melbourne Central,ChIJF0qGqOBD1moRk-XdNWTs2WI,"L02-245/211 La Trobe St, Melbourne",4,Alice Cossette,Comfy seating and nice atmosphere. We ordered the signature pearl milk tea and passion fruit tea. 🧋 Nice flavours and everything is customizable 😃 You order via a tablet and service is very quick. Recommend this place for all bubble tea lovers after studying at State Library 📚
Gotcha Fresh Tea - Melbourne Central,ChIJF0qGqOBD1moRk-XdNWTs2WI,"L02-245/211 La Trobe St, Melbourne",4,Payel Gayen,"Gotcha, at Melbourne Central Shopping Mall is a perfect place for bubble tea enthusiasts. My taste buds were treated to a symphony of flavors as I savored both the Lychee Green Tea and the Gotcha Signature Fruit Tea. What truly sets Gotcha apart is their commitment to customization - you can fine-tune your beverage to perfection by adjusting sugar and ice levels to your liking. I, for one, chose to savor the pure essence of these exquisite teas.

To sweeten the deal further, a special offer graced our visit - the opportunity to enjoy any two of their top 20 drinks in generously sized mugs for a mere $10.

The staff at Gotcha were not only diligent but also friendly, adding a warm and inviting atmosphere to the experience. If you're seeking a refreshing and flavorful journey for your taste buds, look no further than Gotcha. It's a gem in the heart of Melbourne, waiting to delight your senses."
Gotcha Fresh Tea - Melbourne Central,ChIJF0qGqOBD1moRk-XdNWTs2WI,"L02-245/211 La Trobe St, Melbourne",4,Timinmelbourne,"I was recently invited to attend the worldwide launch of @gotchafreshtea and @pokemon

Gotcha farm their own tea, and their drinks are natural. Yep, there's no chemicals or additives. Their drinks are absolutely delicious. I had a Taro fresh milk w mini pearls, which was so good. My mate had a blue pea fruit tea, which was fantastic

Lovely friendly service and pretty quick given that everything is made to order. I'll be back.

Collab"
Gotcha Fresh Tea - Melbourne Central,ChIJF0qGqOBD1moRk-XdNWTs2WI,"L02-245/211 La Trobe St, Melbourne",4,Cade Terence,"Fantastic atmosphere and drinks, one of my favourite tea places.

The atmosphere is cozy and looks great, and you are able to order your tea with all specifications (sugar level, ice level, size) using the touch screen. The pearls are slightly warm due to being freshly made, and they give you a lot. You can really taste the tea 🍵 which I am very satisfied with - it's not just sugar and milk. Great stuff"
Gong cha Chinatown,ChIJgQVFbspC1moRB8G78SAeqbQ,"235 Swanston St, Melbourne",3.7,Gold Silver,"omg ，After drinking a little, I found a mosquito inside. The shop owner should pay attention to food hygiene！thank you！"
Gong cha Chinatown,ChIJgQVFbspC1moRB8G78SAeqbQ,"235 Swanston St, Melbourne",3.7,Nicharee A,"I bought 3 large cups from this store, after I scanned my membership card I was told that they have changed their membership through their application so I need to download their it which I downloaded already when I was in the queue just don't know that they changed and I only need to sign in! Then the staff told me I have to go out of the queue, sign in and come back to order again! Are you kidding me?? I waited about 10 minutes in the queue already to order and you told me to go back to queue up again? I was so disappointed and angry! Nit even ""SORRY"" that she said! You know many bb milk tea shops are operating in Melbourne?? but I still pick you as a royalty customer but look what you have done to me! I chose not to get the membership and ordered anyway. After I paid I tried to sign in the app and it took me not even 1 min! This was ridiculous ever! Not recommended! And not coming back!"
