Name,PlaceID,Address,Rating,Author,Review
The Quarter,ChIJzRa1FbRC1moR01tSbLByQ8s,"27-31 Degraves St, Melbourne",4.3,Radinsa Dharmadasa,Food was really nice and the staff were lovely. We got the pork belly and lamb ribs for main and the tiramisu and mudcake for dessert. A thing to note is the dessert portion sizes are massive so you can definitely share one between people. My mum and I got one each and ended up taking half of both home.
The Quarter,ChIJzRa1FbRC1moR01tSbLByQ8s,"27-31 Degraves St, Melbourne",4.3,Cass C,"With so many options in Degraves, I decided to try The Quarter, but unfortunately, it didn’t quite live up to expectations. I ordered the pulled pork eggs Benedict and the New York bagel, but both dishes were missing key elements. The eggs Benedict was supposed to come with crunchy crackling, which was absent, and the New York bagel didn’t have the mayo as advertised on the menu.

On the bright side, the eggs were cooked well, and the Hollandaise sauce was tasty. However, the service left something to be desired—although our waiter was good the service from the food runners felt a bit abrupt, which added to the overall disappointment.

With so many great spots nearby, I might explore other options next time."
The Quarter,ChIJzRa1FbRC1moR01tSbLByQ8s,"27-31 Degraves St, Melbourne",4.3,Parttimepiggy,"One thing I love about Melbourne is the hidden laneway gems like these ⭐️ you have to check this place out if you haven’t already!

What we ordered:
🍃 Zucchini Flowers $26
🤍 Scallops Linguine $34.50
🍅 Rigatoni all'Amatriciana $27
🤎 Tiramisu $16.50

The food and the ambience here makes for the perfect hang out spot whether you're having a date night or catching up with friends & family. They even had live music on when we visited on a Thursday evening and it was such a vibe!

Onto the food, everything we ate was yum but my favourite dish was definitely the rigatoni. I'm not normally a big fan of tomato / red sauce base pastas but wow this one was sensational. The pasta was perfectly al dente and the bits of pancetta were pan fried to perfection.

Also if you come here make sure to leave some room for their dessert! I was pleasantly surprised at how big the tiramisu serving was and it was soooo delicious. I like that it wasn’t overly sweet and it was actually the perfect size to share between two.

You can find this charming restaurant on Degraves Street which is just a two minute walk away from Flinders Street Station."
The Quarter,ChIJzRa1FbRC1moR01tSbLByQ8s,"27-31 Degraves St, Melbourne",4.3,Rhys G,"Beautiful cafe, well designed. The atmosphere is perfect. The staff and their attention to their customers is exceptional and the food is 10/10. I highly recommend the ""Quarter Eggs Benny"". The pulled pork is exceptional."
The Quarter,ChIJzRa1FbRC1moR01tSbLByQ8s,"27-31 Degraves St, Melbourne",4.3,Vivian William,The chorizo omelette was delicious. Eggs benedict was also very unique and tasty. Coffee was nice. Good little cafe for brunch.
Manchester Press,ChIJg1wLO7VC1moRrzObM92WgkU,"8 Rankins Ln, Melbourne",4.3,Amy (thehungrymelbgirl),"Nestled deep inside Rankins Ln, Manchester Press draws a consistent crowd with its bagels and warehouse vibes.

The last time I dined here was 7 years ago. The chorizo bagel I had back then was well put together and very tasty. The lack of customer service was, however, quite off-putting.

We recently tried Manchester Press again, and we can't fault the warm staff at all. Unfortunately, it was the food that didn't quite hit the mark this time.

We ordered the Bacon and Maple Bagel ($24.50), which on paper sounds like the perfect combination of sweet and savoury. However, it was actually quite difficult to get all the flavours together as it was quite textural. We also weren't sure whether the blueberry bagel was the best flavour to compliment this creation.

We fared a bit better with the Philly Steak Bagel ($23.80), although the chef may have gone a bit overboard with the chipotle mayo and the overall result was not that aesthetically pleasing.

Hojicha Latte ($6.50) is on its current special menu for those wanting to try something different.

It was overall a slightly underwhelming experience, but I am hoping it was only because we went on a bad day..."
Manchester Press,ChIJg1wLO7VC1moRrzObM92WgkU,"8 Rankins Ln, Melbourne",4.3,Pauline,"It’s been many years since I visited Manchester Press.

🥯🫐 I’ve had very fond memories of their blueberry bagel served with the best mascarpone cream mixed with berries and pistachio, so I decided to visit them again after at least 5 years. It most definitely did not disappoint even though the way they whip the cream is now a little different.

I highly recommend the mixed berry bagel if you want a sweet brunch.

🍳 We also had their Egg Benedict and it was superb with a generous serving of bacon.

🍯 Another bagel we tried was their honey ricotta toast, I would have preferred they served a bigger portion of ricotta rather than thinly spread it on the bagel. I wouldn’t mind paying more for it too. I suppose this highlights the bagel rather than the topping."
Manchester Press,ChIJg1wLO7VC1moRrzObM92WgkU,"8 Rankins Ln, Melbourne",4.3,Emily Holm,"This place used to be one of the *it* places in Melbourne. And now…. It’s fine?
Our coffee was still pretty good actually. But our bagels didn’t look or taste nearly as exciting and they used to.
Don’t get me wrong… they were absolutely fine. Just nothing special. The smoked salmon looks unhappy and tasted like supermarket salmon, and the blueberries were sparing.
There was nothing super wrong, but also nothing super right."
Manchester Press,ChIJg1wLO7VC1moRrzObM92WgkU,"8 Rankins Ln, Melbourne",4.3,Ariaan,Service and atmosphere is amazing here! Staff is always so friendly and it’s so cozy inside. I ordered an oat mocha and ham and cheese toasted sandwich takeaway. Oat mocha tasted bland and watery. Toasted sandwich was crunchy and buttery however there wasn’t a lot of cheese and the ham was very salty. The other sandwiches on their menu look amazing though so definitely recommend trying one of those instead! Bagels looked delicious!
Manchester Press,ChIJg1wLO7VC1moRrzObM92WgkU,"8 Rankins Ln, Melbourne",4.3,Cindy Ramli Chang,"Brunch date with the one and only on our wedding anniversary day ❤️
That day I decided that I do not like bagels 🤣
The sandwich was beautiful
Bagels topping was good but I just figured that I do not like that texture. So dense 🤣
But apparently “Good bagels are denser than most bread,”
Well guess I just don’t like it 🙈

The place was buzzing with people enjoying their food. Young, old, kids, adult, they all enjoying the vibes there.
Will come back for more sandwiches 😁

#bulgogi_n_rendang"
Proud Mary Coffee,ChIJQZ-aOeBC1moRuuo3eAh3hGE,"172 Oxford St, Collingwood",4.5,Siren (Siren),"Great little Cafe with a warm vibe. It feels full but you always have space to move and feel comfortable. The decor adds to this
Food was fast and delicious. The Hash just needed a touch more salt."
Proud Mary Coffee,ChIJQZ-aOeBC1moRuuo3eAh3hGE,"172 Oxford St, Collingwood",4.5,manooch,"If you want to have different experiences with morning coffee definitely you need to get there and get them a go. They have got a specific menu just for coffee that brings you knowledge about the variety of coffee beans.  Also, they got delicious breakfast and very helpful staff."
Proud Mary Coffee,ChIJQZ-aOeBC1moRuuo3eAh3hGE,"172 Oxford St, Collingwood",4.5,Tristan,"My experience at Proud Mary Coffee was a bit underwhelming, especially after hearing so many high compliments. While they seem to know their coffee well, my soy flat white was disappointing—the foam on top ruined the taste and didn’t look appealing either. The kimchi avo on toast tasted great, but the kimchi wasn’t the traditional Korean spicy kind, and while the toppings were delicious, the bacon felt overlooked. I admire their experimental twist on classic brunch dishes, but the execution still needs some polishing. Considering this place is a bit expensive, I did expect the dish to be perfect. I’ll give this place another chance."
Proud Mary Coffee,ChIJQZ-aOeBC1moRuuo3eAh3hGE,"172 Oxford St, Collingwood",4.5,Derek Hum,"Great place for coffee and a meal. Dishes are unique and delicious. The tiramisu hotcakes was a nice dessert which we shared - might've been too much for one I think.

Piccolo was good and the cold drip was refreshing, if a bit small."
Proud Mary Coffee,ChIJQZ-aOeBC1moRuuo3eAh3hGE,"172 Oxford St, Collingwood",4.5,Simon T,Excellent spot for coffee and breakfast. Be sure to ask for today's coffee recommendations. Always busy and vibrant
Riché - Cafe Richmond,ChIJ3cZApzdD1moRFvz4e0vlik8,"3/189 Bridge Rd, Richmond",4.8,Tolga O,"We had a fantastic experience at Riche, and highly recommend it. The menu has plenty of creative options that let it stand out from your generic local cafe. The food is well, portioned and tastes great.
The atmosphere is energetic, so I'd highly recommend a booking if coming on the weekend.
My partner had the pumpkin king, and along with my Riche burger, we enjoyed both meals and left full.
On the drinks side we enjoyed a black sesame latte (surprisingly enjoyable), and a berry smoothie (tasted healthy and light).
We'd definitely come again."
Riché - Cafe Richmond,ChIJ3cZApzdD1moRFvz4e0vlik8,"3/189 Bridge Rd, Richmond",4.8,Ivan Lu,"I visited Riché Cafe on a weekday morning, and it was moderately busy. I ordered a soy latte, which had nice latte art and tasted great. However, I also tried the Prawny Business dish. Unfortunately, there were only 3-4 small shrimp, and they were a bit overcooked and dry, almost like they had been pre-cooked and then re-fried. On a positive note, the service was excellent; the staff checked in on me several times to ensure everything was okay. Overall, it was a mixed experience."
Riché - Cafe Richmond,ChIJ3cZApzdD1moRFvz4e0vlik8,"3/189 Bridge Rd, Richmond",4.8,Nana Pun,"This restaurant is one of the best brunch places I’ve ever visited. We must go again; the food is incredibly delicious with a fusion design that offers a fresh take on classic dishes. The bread, French toast, and pumpkin base are all wonderfully soft, and the seasoning enhances every flavor. Words can’t fully describe how much we enjoyed the whole experience. Highly recommended!"
Riché - Cafe Richmond,ChIJ3cZApzdD1moRFvz4e0vlik8,"3/189 Bridge Rd, Richmond",4.8,William Hua,"A lovely cafe with a wide variety of food options, a clean and aesthetic interior, as well as friendly service staff.

The speed of deliver is also something I must mention, all the dishes we ordered come out in around 10-15 min, despite the cafe being relatively lively at the time.

The price was definitely reasonable as well. So deffs worth a try or making this place a regular spot if you live close by!"
Riché - Cafe Richmond,ChIJ3cZApzdD1moRFvz4e0vlik8,"3/189 Bridge Rd, Richmond",4.8,Matt,"Food was OK, but nothing special. You can find a better burger almost anywhere, but the chips were good. Long black and curry laksa also nice but quite average."
The League of Honest Coffee,ChIJ71r4xc5C1moRVjrA0cOSPuA,"8 Exploration Ln, Melbourne",4.5,Sonja Pitt,"Pretty abysmal food and coffee on a Saturday morning. Thought they’d have more specialty coffee type stuff, but coffee served in a bowl certainly isn’t it… Did someone forget to wash the mugs or cups??

Only a few toasties left at 10am, no kitchen…. Had one tomato and cheese and one ham and cheese croissant. Gas station quality. Basically no ham/cheese/tomato in them at all. Not nearly enough for breakfast for one person. Some thick cut tomatoes and less stingy on the ham and tomato would have made up for the lack of quality elsewhere.

Filter coffee was OK, but probably under extracted. Lighter roast or better selection would have been better.

Maybe come here if you’re after just a quick to-go coffee, will probably be better than a takeaway elsewhere… But pretty sad for dine-in."
The League of Honest Coffee,ChIJ71r4xc5C1moRVjrA0cOSPuA,"8 Exploration Ln, Melbourne",4.5,Abizer Mohmedi,"Had an honest “bowl” of Flat White to start my day, with a delicious Chk-Avocado-Spinach toastie
The coffee was well made with perfectly steamed and textured milk. The bean flavour was coming through so well 🤎😍
The toastie had some peppercorn kernels adding the right amount of heat at intervals. With the cheese and spinach, it was very flavoursome. I could have done with more avocado though- it was hard to find/taste.
This is my second trip here, while visiting the city and it’s becoming my go-to café! ☕️
Well done, guys ✨🌟"
The League of Honest Coffee,ChIJ71r4xc5C1moRVjrA0cOSPuA,"8 Exploration Ln, Melbourne",4.5,Lucy Bui,"Delicious hot chocolate, a little rich for my liking but was very well made. We ordered a chicken sandwich which was also great, a little salty but very enjoyable. I was disappointed that they did not have any matcha but the lovely staff and cozy atmosphere definitely made up for it. Excited to return and try out more of the menu!"
The League of Honest Coffee,ChIJ71r4xc5C1moRVjrA0cOSPuA,"8 Exploration Ln, Melbourne",4.5,John Domingo,"Ordered an oat mocha, iced latte, mushroom toastie, and cheese & tomato toastie. The cup for the mocha was really cute! The coffee was amazing. The toasties were pretty filling.

The iced latte was on the smaller size, but would probably just need to order a bigger cup next time."
The League of Honest Coffee,ChIJ71r4xc5C1moRVjrA0cOSPuA,"8 Exploration Ln, Melbourne",4.5,IL Deko,"This cafe is just opposite to the hotel so it’s the most convenient when you need that caffeine in the morning. It’s super duper busy with the working crowds coming in for their cuppa and you would think the coffee must be great. Unfortunately NOT the case, the long black is under extracted and taste awfully sour. Definitely won’t drop in again."
Station Street Cafe,ChIJ0W4dN9c41moRf48Xy5zX8w4,"26 Station St, Nunawading",4.3,Andy T,"""I absolutely love this cafe! The atmosphere is cozy and welcoming, perfect for catching up with friends and family. The staff is incredibly friendly and attentive, always ready with a smile. The coffee is Exceptional! Food was absolutely delicious, and they offer a wide variety of options to suit every taste. I can't wait to return!"""
Station Street Cafe,ChIJ0W4dN9c41moRf48Xy5zX8w4,"26 Station St, Nunawading",4.3,Serena C,"Really good coffee and tasty food. Owners and staff are very friendly and will remember you by name. Great family Cafe to visit on the weekends 😊
Will visit again!"
Station Street Cafe,ChIJ0W4dN9c41moRf48Xy5zX8w4,"26 Station St, Nunawading",4.3,MIRACLE MIRIIN,"I was there this morning to get some coffee, muffin and banana bread. The barista is very unwelcoming and not even greeting.
No smile No service No communication Not even thank you.
And the worst part is the coffee.
I asked for mocha strong chocolate and look what I got. The coffee is not even full and how on earth the Mocha has no froth?
This is not even considered a Flat White.
This is unacceptable at all.
I pay around $16 for this?
And yes she ruined my morning. 😕"
Station Street Cafe,ChIJ0W4dN9c41moRf48Xy5zX8w4,"26 Station St, Nunawading",4.3,Ean Sugarman,"Interesting Breakfast cafe but nobody there and service felt indifferent.
On the outside this looks like a great place. Food was timely and tasty but not hot.
Maybe it was empty because it was lunchtime but my young-ish server who was efficient and courteous didn’t seem to want to be there.
Food good, service appropriate but not warm and atmosphere fine but no one there. I would go back to see if anything changed."
Station Street Cafe,ChIJ0W4dN9c41moRf48Xy5zX8w4,"26 Station St, Nunawading",4.3,Two Sheds,"Station St Cafe

3.7

Cute cafe right beside the station as the name suggests.  Surprisingly large and not unpleasantly decorated with occasional splashed of greenery.  Good music playing.    Overall, there’s a good relaxed feel here.  Quick stop only today as I was time poor.  The coffee here was ace.  Rich, silky and powerful.  Just as I like it.  A good tasty reasonably priced egg, cheese and bacon muffin was had as well.  Service was friendly and cheerful.  On what I saw today, I’m not surprised this cafe is well regarded."
Golden Mug Cafe,ChIJl82ld4ld1moRVDKGZBC2-IA,"Ground Floor of Novotel Hotel, 399 Little Lonsdale St, Melbourne",4.5,Elaine V. Reglos,"Went to dine in with my grandma and auntie as they were on a tourist visa. We spotted this cozy cute cafe and tried some of their dish.

The amount of the food is huge and delicious. Coffee is very good as well, we have experience the best customer service as well her name’s Vanessa. Will definitely come back for another experience!"
Golden Mug Cafe,ChIJl82ld4ld1moRVDKGZBC2-IA,"Ground Floor of Novotel Hotel, 399 Little Lonsdale St, Melbourne",4.5,Jennie,"The steak at this restaurant is an unforgettable delight. Each bite of the steak is tender, juicy, and perfectly grilled, with a delicious flavor. The prawn salad is refreshing and delicious, with fresh prawn complemented by crisp lettuce and salad dressing, bringing a refreshing seafood flavor. As for the garlic cheese bread, it's a wonderful combination, with a soft texture and a surface sprinkled with rich cheese and garlic flavor, each bite is a delight. Overall, this meal is satisfying and a feast for the taste buds."
Golden Mug Cafe,ChIJl82ld4ld1moRVDKGZBC2-IA,"Ground Floor of Novotel Hotel, 399 Little Lonsdale St, Melbourne",4.5,Hara,"I had high expectations, but my experience was disappointing. I ordered the bacon eggs benedict, and the eggs were too sour. Is this really bacon? There wasn't even a hash brown! The place felt busy but didn't deliver on quality. I won't be coming back"
Golden Mug Cafe,ChIJl82ld4ld1moRVDKGZBC2-IA,"Ground Floor of Novotel Hotel, 399 Little Lonsdale St, Melbourne",4.5,Yosy Christy Natalia,"Perfect spot to grab your late afternoon coffee cuz they open until 6pm!

Comfortable sitting table on the Ground floor of Novotel hotel. They have so many various of foods (breakfast, lunch and dinner menu). Coffee is also great!

Highly recommend!"
Golden Mug Cafe,ChIJl82ld4ld1moRVDKGZBC2-IA,"Ground Floor of Novotel Hotel, 399 Little Lonsdale St, Melbourne",4.5,Sylvia Liu,"We had a delightful brunch at this spot, enjoying a variety of dishes including chili scramble, egg royal, seafood penne pasta, and a fresh fruit bowl. The drinks were also standout, with both the chai latte and iced taro being refreshing and flavorful. Everything was delicious."
George Street Cafe,ChIJa1u8T-lC1moRdlHXWeMy7ls,"65 George St, East Melbourne",4.4,Erica Kingham-Bradley,"Stopped in for a Saturday lunch; what a hidden gem. The food came very quickly despite being busy.
Everything from the drinks to the chips were delicious. The staff were very friendly.

Will definitely be back!"
George Street Cafe,ChIJa1u8T-lC1moRdlHXWeMy7ls,"65 George St, East Melbourne",4.4,Mel,"Beautiful coffee and breakfast close to Quest East Melbourne. Absolutely recommend this lovely coffee shop. The latte was perfect and smashed avo on toast with poached eggs was just the way I like it, runny yolk with cooked whites."
George Street Cafe,ChIJa1u8T-lC1moRdlHXWeMy7ls,"65 George St, East Melbourne",4.4,David Spencer,Generously sized breakfast offerings but they were a little underwhelming in flavour.  The service is cheerful and prompt.  Decent coffee.  Would score them three and half if I could.
George Street Cafe,ChIJa1u8T-lC1moRdlHXWeMy7ls,"65 George St, East Melbourne",4.4,Paul Richards,"A nice cafe, just a short walk from Wellington Parade. The beef brisket toastie/burger (a lunch special) was very good, as was the mango smoothie. I'll be back!"
George Street Cafe,ChIJa1u8T-lC1moRdlHXWeMy7ls,"65 George St, East Melbourne",4.4,Tanja Genovese (muppet),"We absolutely love George Street Cafe. It's become our new fortnightly place to dine. The food is always fresh and delicious, and the coffee always tastes great.

The atmosphere is great, and Michael and his team are amazing and friendly. We always leave smiling and happy."
Crest Café,ChIJZ11Z5OM91moRltqBosqk31A,"17 Crestdale Rd, Wantirna",4.5,Christopher Lai,"Great food, excellent coffee
We've been here a few times now.
Food is always good and coffee is to our liking.

They have a kids menu which is always a bit plus.
They also sell candy which is fun for the kids.

I just wish this place is warmer in the winters and cooler in the summer but that is just a minor thing.

We will be back. Definitely the best cafe in the knox area!"
Crest Café,ChIJZ11Z5OM91moRltqBosqk31A,"17 Crestdale Rd, Wantirna",4.5,Claudine Faerie,"Nice cafe, tucked away in the side streets of suburbia. Coffees and hot drinks were good! Menu had lots of favourites and some items with a fun twist! Our food was well presented and delicious and we predominantly enjoyed our meals...The green hashbrown dish was yummy ( but came served with a hair and the fritters were cold inside)
We did have difficulties making our reservation ( getting someone to answer the phone took 5 tries over 2 days)"
Crest Café,ChIJZ11Z5OM91moRltqBosqk31A,"17 Crestdale Rd, Wantirna",4.5,MTWTFSS,Hidden gem in the neighbourhood! Coffee is always done well! The cafe is kids and pets friendly! Very thoughtful staff! Our favorite cafe!
Crest Café,ChIJZ11Z5OM91moRltqBosqk31A,"17 Crestdale Rd, Wantirna",4.5,King Katt,"The corn fritter was good, and the coffee was nice too. The poached egg can be improved.  However, one of the female staff members was not friendly."
Crest Café,ChIJZ11Z5OM91moRltqBosqk31A,"17 Crestdale Rd, Wantirna",4.5,Shayan Soroush,"Small cafe near Knox shopping centre, talked away in the local streets and if you don’t look close you’ll think it’s an ordinary house, cute atmosphere.

I ordered the golden latte with tumeric, almond milk and cinnamon. It had such a rich and spicy flavour, highly recommend.

The staff were very attentive and friendly 🙏"
Two Birds One Stone Cafe South Yarra,ChIJb0Hx2qpD1moRvCedtK1H-g4,"12 Claremont St, South Yarra",4.4,Weiqi Wang,"The dining experience was excellent. We ordered two dishes: Fresh Chili Scrambled Eggs and Sauteed Mixed Mushrooms. The Fresh Chili Scrambled Eggs were different from what you usually find elsewhere; they used fresh chilies, and the eggs were incredibly tender. The Sauteed Mixed Mushrooms featured a variety of mushrooms served with two poached eggs on top of a slice of toast, which had a firm and crispy texture—healthy and delicious. Both dishes were very generous in portion, leaving us feeling full. We'll definitely be back next time."
Two Birds One Stone Cafe South Yarra,ChIJb0Hx2qpD1moRvCedtK1H-g4,"12 Claremont St, South Yarra",4.4,Melody,"Great dining experience! Both meals are delicious! The shape is also very good-looking ~ Lamb pasta recommended! The lamb stew is very soft, rich sauce wrapped in the pasta, really delicious! Another dessert is also a surprise, the sweetness is just right! My friend loves hot chocolate. It's delicious! Service and dining environment are very good! Will come again!"
Two Birds One Stone Cafe South Yarra,ChIJb0Hx2qpD1moRvCedtK1H-g4,"12 Claremont St, South Yarra",4.4,Suzanne Kehl,"We were here for brunch and it was pretty good. Our group had a mixture of eggs & bacon, pancakes and scrambled eggs with kids meals.  Everything was delicious. Coffee was good too. A fairly busy place. The only negative was the booths are quite tight to get into. My daughter is pregnant and couldn't get in at all so had to sit on a stool. Service was good so overall a lovely place to go for brunch."
Two Birds One Stone Cafe South Yarra,ChIJb0Hx2qpD1moRvCedtK1H-g4,"12 Claremont St, South Yarra",4.4,Shayini Rattambige,"I was craving to get a french toast on a Saturday and found this place. Honestly,  the atmosphere is great, it's a cosy cafe with great design. It was busy on a Saturday, I recommend that you reserve in advance to get a better seat. Staff were too busy to actually provide good service. Food was mediocre, I'd go again when it's less busy to check it out. Prices are high for the quality of food. I got 2 coffee's, a french toast and my husband got a full breakfast, the breakfast dish was actually a good portion. We paid $75."
Two Birds One Stone Cafe South Yarra,ChIJb0Hx2qpD1moRvCedtK1H-g4,"12 Claremont St, South Yarra",4.4,Daisy W,"Coming back to Two Birds One Stone Cafe in South Yarra after years was so nice. It’s still a perfect spot for brunch with friends. The Breakfast Board gave me with a serious case of food envy as I ordered the grilled salmon. The pancakes, were just as good as I remembered - fluffy and perfectly cooked. The service was also excellent as they accommodated me with the wheelchair. Two Birds One Stone remains a top choice for brunch in South Yarra."
Foundry Lane Cafe,ChIJ5xE5UtpD1moR4eJt1zNASNU,"150 Lonsdale St, Melbourne",4.6,XZ C,"It's a delightful experience that I purchased coffee from this Cafe.

Friendly staff and very warm welcoming environment, especially in a chilly morning, this coffee and her beautiful smile made my day.
Thank you so much Elle. :-)

Strongly recommend to people who working or traveling near 150 Lansdale St in city. The waiting area in the lobby is also very impressive."
Foundry Lane Cafe,ChIJ5xE5UtpD1moR4eJt1zNASNU,"150 Lonsdale St, Melbourne",4.6,My Uno Support,"Great coffee, delicious pastries & friendly service"
Foundry Lane Cafe,ChIJ5xE5UtpD1moR4eJt1zNASNU,"150 Lonsdale St, Melbourne",4.6,Jason Berek-Lewis,"The best coffee I've had in the city in years. The strong piccolo or 3/4 latte is beautifully balanced, perfectly smooth and outstandingly delicious. The small bikkie on top in the icing on the cake."
